product_url,image_url,price,title
https://www.alibaba.com/product-detail/Promotional-T50-FPV-Agricultural-Drone-Repair_10000035168677.html?priceId=ead644e6fcb845d68fc3a5a422effa83,https://s.alicdn.com/@sc04/kf/Ac0d8d21da5fb424aa05a6c49dcee7611F.png_300x300.png,$45,Promotional T50 FPV Agricultural Drone Repair  T50 FPV  Module Agras T50 FPV Module
https://www.alibaba.com/product-detail/WG9525580862-Right-Camera-for-Construction-Machinery_1601555256945.html?priceId=ead644e6fcb845d68fc3a5a422effa83,https://s.alicdn.com/@sc04/kf/H86a7ee38e41d4954ac190ecdd375aa12Q.png_300x300.png,$34,WG9525580862 Right  for Construction Machinery
https://www.alibaba.com/product-detail/Neutral-MC-L12B-IMX335-SSC30KQ-CCTV_1601517421190.html?priceId=ead644e6fcb845d68fc3a5a422effa83,https://s.alicdn.com/@sc04/kf/H936b0d3358ba4db1abc4348541bccfe5A.jpg_300x300.jpg,$19.13-21.59,Neutral MC-L12B IMX335 SSC30KQ CCTV 5MP  2.8mm Lens Made in China UAV Spare  IP  Module Board Drone Components
https://www.alibaba.com/product-detail/Ningbo-Stainless-Steel-Camera-Housing-Stamping_1601687541733.html?priceId=ead644e6fcb845d68fc3a5a422effa83,https://s.alicdn.com/@sc04/kf/Hceb9429bb4bc439e824420537f90bae8H.png_300x300.png,$14.36,Ningbo Stainless Steel  Housing Stamping Drawing  Stretch Processing
https://www.alibaba.com/product-detail/Aluminum-Alloy-Custom-Camera-Parts-Sandblasting_1601634412622.html?priceId=ead644e6fcb845d68fc3a5a422effa83,https://s.alicdn.com/@sc04/kf/H1e3f140fe1e44eeba308909be6c711634.png_300x300.png,$0.83-1.58,"Aluminum Alloy, Custom  , Sandblasting and Oxidation Treatment, Precision CNC Machining High-end"
https://www.alibaba.com/product-detail/Camera-Module-for-FPV-Drone-Digital_1601674613139.html?priceId=ead644e6fcb845d68fc3a5a422effa83,https://s.alicdn.com/@sc04/kf/H53f31fabdc0143b9bcbfe7d80bc46ddbp.png_300x300.png,$8.50-9.50,Module for FPV Drone Digital  Compatible with T-Head Second-Generation Zinc Alloy Case
https://www.alibaba.com/product-detail/Keyence-IV3-G600CA-IV3-G600MA-Vision_1601668910983.html?priceId=ead644e6fcb845d68fc3a5a422effa83,https://s.alicdn.com/@sc04/kf/Hddc66b23a9a449708d119a96c3ff21d5H.png_300x300.png,$711.29,Keyence IV3-G600CA IV3-G600MA Vision Sensor Smart  Sensor Head for Automated Recognition Genuine  Price Negotiation
https://www.alibaba.com/product-detail/Metal-Seals-Seal-Lens-Ring-Gasket_1601407768451.html?priceId=ead644e6fcb845d68fc3a5a422effa83,https://s.alicdn.com/@sc04/kf/Hbf294e7eee824959932110647a3a9173d.png_300x300.png,$2.86-3.10,Metal Seals Seal Lens Ring Gasket Essential Component for  and Photography Equipment
https://www.alibaba.com/product-detail/Xiamen-OEM-Aluminum-Conversion-Camera-Screw_1601520432626.html?priceId=ead644e6fcb845d68fc3a5a422effa83,https://s.alicdn.com/@sc04/kf/He98e8bace918421baa13641acbba325cj.jpg_300x300.jpg,$0.50-0.95,Xiamen OEM Aluminum Conversion  Screw Fixed Adapter Mount Bracket Convert Dslr  Light Stand Tripod
https://www.alibaba.com/product-detail/Hot-Sale-Aluminum-Quick-Release-Plate_1600254362382.html?priceId=ead644e6fcb845d68fc3a5a422effa83,https://s.alicdn.com/@sc04/kf/H96c1b68e0cc848c8972a0ab24f0b0e87k.jpg_300x300.jpg,$5.89-7.10,Hot Sale Aluminum Quick Release Plate Oem Odm  Accessories Quick Release Plate
https://www.alibaba.com/product-detail/1500TVL-JINJIEAN-B19-Mini-1-3_1601517154750.html?priceId=ead644e6fcb845d68fc3a5a422effa83,https://s.alicdn.com/@sc04/kf/H3efa19c1127042c68f3822ed0bc4957cd.jpg_300x300.jpg,$5.99-8.99,1500TVL JINJIEAN B19 Mini 1/3 CMOS FPV  With PAL/NTSC System 3DNR With OSD Internal Adjustable Power 5V-30V for Drone
https://www.alibaba.com/product-detail/High-Quality-Stainless-Steel-Metal-Plastic_1601008516721.html?priceId=ead644e6fcb845d68fc3a5a422effa83,https://s.alicdn.com/@sc04/kf/Haf4e5e247ed0421c98a7a3909464e7ecd.jpg_300x300.jpg,$1.11-9.99,High Quality Stainless Steel Metal Plastic Nonstandard CNC Machining Service for Instant Photography   Prototyping
https://www.alibaba.com/product-detail/Small-Front-Facing-Camera-for-iPhone_1601369910104.html?priceId=69a84455cb644cf789eb0b938ff23400,https://s.alicdn.com/@sc04/kf/H74dbfbca5e9d4ea9a254c4703a2b9664K.png_300x300.png,$2.64-4.33,Small Front Facing  for iPhone 11 11Pro 11ProMax Electronics Repair
https://www.alibaba.com/product-detail/LanParte-Action-Camera-1-4-Screw_1601126789105.html?priceId=69a84455cb644cf789eb0b938ff23400,https://s.alicdn.com/@sc04/kf/Hcd98a2a9379c44d8960dfa55bd058c7eI.jpg_300x300.jpg,$14.50,"LanParte Action  1/4"" Screw Thread Quick Release Plate Magic Arm Monitor Adapter Sport  Press Type Fast V Lock Mount"
https://www.alibaba.com/product-detail/Factory-Parts-Mobile-Phone-Camera-Back_1600778722683.html?priceId=69a84455cb644cf789eb0b938ff23400,https://s.alicdn.com/@sc04/kf/H5f342719cd6145f19b3ba9cc7376cc4fc.jpg_300x300.jpg,$28.50,Factory  Mobile Phone  Back  Rear  for Iphone12 Pro Max
https://www.alibaba.com/product-detail/For-Nikon-DSLR-Camera-Lens-Replacement_1601281413684.html?priceId=69a84455cb644cf789eb0b938ff23400,https://s.alicdn.com/@sc04/kf/Hda494f7d895445eca5802d545591edc9M.jpg_300x300.jpg,$0.90,For Nikon DSLR  Lens Replacement Bayonet Base Ring for Nikkor 18-55 18-105 18-135 55-200
https://www.alibaba.com/product-detail/Sports-Camera-Accessories-Parts-Metal-Super_1601445242073.html?priceId=69a84455cb644cf789eb0b938ff23400,https://s.alicdn.com/@sc04/kf/H170dce8fed1a4c478cff87edff0a8b8a3.jpg_300x300.jpg,$2.69-3.93,Sports  Accessories  Metal Super Clamp Mount With 1/4 Screw Mini Ball Head Adapter Hot Shoe
https://www.alibaba.com/product-detail/ABKN-Camera-Lens-Cover-Soft-Silicone_1601635423350.html?priceId=69a84455cb644cf789eb0b938ff23400,https://s.alicdn.com/@sc04/kf/H57d9d086997c4661af692628ccb26af0S.jpg_300x300.jpg,$0.99,ABKN- Lens Cover Soft Silicone Protective Cap Replacement  for Canon Nikon Sony Olympus Fuji Lumix Pentax SLR DSLR Ca
https://www.alibaba.com/product-detail/New-Arrival-High-Speed-Mirror-Shutter_1601405324202.html?priceId=69a84455cb644cf789eb0b938ff23400,https://s.alicdn.com/@sc04/kf/H8ada0243704441ef96a64f8f5b5e1360p.jpg_300x300.jpg,$36.60,New Arrival High-Speed Mirror Shutter for  Module 1/2000s 1/4000s 11.7mm  Shutter Accessory
https://www.alibaba.com/product-detail/Wholesale-Original-LCD-Display-Screen-for_1601665048721.html?priceId=69a84455cb644cf789eb0b938ff23400,https://s.alicdn.com/@sc04/kf/Hb1c5d5140b6943138e69061e64cdd3e0A.jpg_300x300.jpg,$82.99-86.50,Wholesale Original LCD Display Screen for Canon EOS 750D  Repair
https://www.alibaba.com/product-detail/VicSound-Factory-Price-1-4-20_1600919199056.html?priceId=69a84455cb644cf789eb0b938ff23400,https://s.alicdn.com/@sc04/kf/Hef6af5c8703d4008887aa48b709d17a2A.jpg_300x300.jpg,$0.60-0.70,VicSound Factory Price 1/4-20 D Ring Socket Quick Release Mount Wholesale Sports Action  Adapter Hidden Thumb Screw Quick
https://www.alibaba.com/product-detail/Custom-LED-Video-Camera-Parts-Light_1601578025843.html?priceId=69a84455cb644cf789eb0b938ff23400,https://s.alicdn.com/@sc04/kf/H8f515ac1241040e3b1b68e3e6ffd5182k.jpg_300x300.jpg,$15,Custom LED Video   Light Metal Magnesium Die Casting Services
https://www.alibaba.com/product-detail/SMT-NXT-Fuji-XP143-K1131F-CCD_1600097238457.html?priceId=69a84455cb644cf789eb0b938ff23400,https://s.alicdn.com/@sc04/kf/H7679c4d7f0114d89955bde9b3d0f339cM.jpg_300x300.jpg,$30,SMT NXT Fuji XP143 K1131F CCD  XC-HR50 SMT Spare
https://www.alibaba.com/product-detail/Industrial-Camera-Lens-5MP-8mm-C_1601669700524.html?priceId=69a84455cb644cf789eb0b938ff23400,https://s.alicdn.com/@sc04/kf/H178403ac3c264fda9da5f0bf7492c387j.png_300x300.png,$83-85,"Industrial  Lens 5MP 8mm C-Mount Fixed Focus F2.4-16 2/3"" Optical Glass Aluminum Alloy for Machine Vision 3D Scanning"
https://www.alibaba.com/product-detail/XTJ-Polymer-Custom-Rapid-Prototype-Sla_1601437234043.html?priceId=69a84455cb644cf789eb0b938ff23400,https://s.alicdn.com/@sc04/kf/H35b6cb3fa4994a17a8fcceba08f99e64W.jpg_300x300.jpg,$2.14-2.50,XTJ Polymer Custom Rapid Prototype Sla Sls 3D Printing  Digital  3D Printing Body  Metal Printing 3D
https://www.alibaba.com/product-detail/1807-Dslr-Camera-Spare-Parts-Outdoor_62168383677.html?priceId=69a84455cb644cf789eb0b938ff23400,https://s.alicdn.com/@sc04/kf/HTB1IiOkdl1D3KVjSZFyq6zuFpXa7.jpg_300x300.jpg,$6-15,1807 Dslr  Spare  Outdoor Pan Tilt Rolling Axis Pitch Shaft Gimbal Motor Brushless
https://www.alibaba.com/product-detail/FP100-Micro-PFLY-FPV-Camera-Drone_1601210539704.html?priceId=69a84455cb644cf789eb0b938ff23400,https://s.alicdn.com/@sc04/kf/H2ff5ded57abf43eeae58901ba3cb7526J.jpg_300x300.jpg,$12-14,FP100 Micro PFLY FPV  Drone 0.000001Lux 2.1mm Lens 16-9/4-3 NTSC/PAL Switchable Replacement Lens FPV  RC  Accs
https://www.alibaba.com/product-detail/JingYing-Aluminum-Alloy-Lightweight-Fixed-1_1600986462601.html?priceId=69a84455cb644cf789eb0b938ff23400,https://s.alicdn.com/@sc04/kf/H5385af6b6c064cfc81566c1189fbc55ab.jpg_300x300.jpg,$2.88-4,JingYing Aluminum Alloy Lightweight Fixed 1/4 Screw Universal Hot Shoe Mount  Monitor Rotating Snail Ball Head
https://www.alibaba.com/product-detail/Jinnet-Spare-Parts-BG-E100-Camera_1443563110.html?priceId=69a84455cb644cf789eb0b938ff23400,https://s.alicdn.com/@sc04/kf/HTB1iJfiKqmWBuNjy1Xaq6xCbXXaT.jpg_300x300.jpg,$18.50-19,Jinnet Spare  BG-E100  Battery Grip for Canon EOS 100D Rebel SL1
https://www.alibaba.com/product-detail/Honfly-Repair-Parts-Mobile-Phone-Back_1601023246578.html?priceId=69a84455cb644cf789eb0b938ff23400,https://s.alicdn.com/@sc04/kf/H16da80a7596b4f79a590f2364905e2dd7.jpg_300x300.jpg,$4.29-5.71,Honfly Repair  Mobile Phone Back  With Flex Cable New Rear Main  for Redmi Note 11 Big Head Rear
https://www.alibaba.com/product-detail/For-DJI-Mavic-Air-2S-Gimbal_1601580194350.html?priceId=69a84455cb644cf789eb0b938ff23400,https://s.alicdn.com/@sc04/kf/H5d05abab7b1048f3a2f5dbec45f72375m.jpg_300x300.jpg,$23-35,For DJI Mavic Air 2S Gimbal  Yaw Arm With Motor Shock Absorber Bracket Replacement for DJI Air 2S Drone
https://www.alibaba.com/product-detail/Hot-Sale-T40-T20P-T50-FPV_1601519603820.html?priceId=69a84455cb644cf789eb0b938ff23400,https://s.alicdn.com/@sc04/kf/H2ebbf8dec8a343628f8e0e498fb0897dF.jpg_300x300.jpg,$1.80-2.20,Hot Sale T40 T20P T50 FPV  Repair  T40 FPV  Module Accessory T40 T50  Lens Glass
https://www.alibaba.com/product-detail/iPhone-15-Front-Camera-Electronics-Repair_1601560655536.html?priceId=69a84455cb644cf789eb0b938ff23400,https://s.alicdn.com/@sc04/kf/Ha7325e139e8a42e3b67183821aa07b45K.jpg_300x300.jpg,$13.02-13.61,iPhone 15 Front  Electronics Repair
https://www.alibaba.com/product-detail/Hard-Anodizing-Black-Cameral-Frame-for_1601572245036.html?priceId=69a84455cb644cf789eb0b938ff23400,https://s.alicdn.com/@sc04/kf/Hd19bd50bfe6c440b962638d38c58eb5fG.jpg_300x300.jpg,$0.80-1,Hard Anodizing Black Cameral Frame for Deep Sea Explore Custom Machining Spare  for Marine
https://www.alibaba.com/product-detail/100-Original-Mobile-Parts-Rear-Camera_1600481712004.html?priceId=69a84455cb644cf789eb0b938ff23400,https://s.alicdn.com/@sc04/kf/H58a493d673d14a15b1a9a4abe5e20447k.jpg_300x300.jpg,$5.85-6.15,100% Original Mobile  Rear  for Huawei P40 PRO Back  Original Replacement Real  Flex
https://www.alibaba.com/product-detail/957604H000-Parking-Assist-Camera-Rear-view_1601268724968.html?priceId=69a84455cb644cf789eb0b938ff23400,https://s.alicdn.com/@sc04/kf/H360e4956466e43f1be61b64ae473e100N.jpg_300x300.jpg,$7-9,957604H000 Parking Assist  Rear-view Reverse  Car Back-up Video  High Quality Automotive Electronic
https://www.alibaba.com/product-detail/High-Quality-Custom-Photographic-Equipment-Stainless_1601196012802.html?priceId=69a84455cb644cf789eb0b938ff23400,https://s.alicdn.com/@sc04/kf/Ha8e21201d087458baf04009deeed9fbfs.jpg_300x300.jpg,$0.30-1.20,High Quality Custom Photographic Equipment Stainless Steel Screw for  CNC Machined
https://www.alibaba.com/product-detail/OEM-Factory-Customized-Equipment-Protective-Shell_1601656230175.html?priceId=69a84455cb644cf789eb0b938ff23400,https://s.alicdn.com/@sc04/kf/H74103c7fd97540c6a9d57ce89edf78e4B.jpg_300x300.jpg,$0.60-1.20,OEM Factory Customized Equipment Protective Shell Aluminum Alloy Zinc Alloy Die-cast  Housing Accessories
https://www.alibaba.com/product-detail/Custom-Camera-Cage-Rig-Handle-CNC_1601651409994.html?priceId=69a84455cb644cf789eb0b938ff23400,https://s.alicdn.com/@sc04/kf/H718c03a867784cd29bfc064c9e5561a6Z.jpg_300x300.jpg,$1-10,Custom  Cage Rig Handle CNC Milling Dongguan Factory Aluminum Stainless Steel
https://www.alibaba.com/product-detail/High-Quality-KEYENCE-CV-022U-Ultra_1601684915902.html?priceId=69a84455cb644cf789eb0b938ff23400,https://s.alicdn.com/@sc04/kf/H3d5952a9a2064d699a3d0e2e86dd804fn.png_300x300.png,$241-260,High Quality KEYENCE CV-022U Ultra Small Digital Speed Black and White  Control  CV-2000 Series
https://www.alibaba.com/product-detail/Smt-Machine-Spare-Parts-Samsung-CP40_1600469586845.html?priceId=69a84455cb644cf789eb0b938ff23400,https://s.alicdn.com/@sc04/kf/He7db1516afc54433a282359891f0fcb6v.jpg_300x300.jpg,"$1,00,008.99",Smt Machine Spare  Samsung CP40 CP45 CCD  XC-75 J1300491
https://www.alibaba.com/product-detail/OEM-Factory-Offers-Anodized-Aluminium-CNC_1601387798331.html?priceId=69a84455cb644cf789eb0b938ff23400,https://s.alicdn.com/@sc04/kf/H22133bc184f048279d8e65ad32d99aacu.jpg_300x300.jpg,$35-50,OEM Factory Offers Anodized Aluminium CNC Machining Services for  Lenses Metal Spare  for Photography Accessories
https://www.alibaba.com/product-detail/Custom-Action-Camera-Ball-Head-Mount_1601612106822.html?priceId=69a84455cb644cf789eb0b938ff23400,https://s.alicdn.com/@sc04/kf/Ha4aa3f62629e49f58585bd689a4d581f6.jpg_300x300.jpg,$0.80-2.10,Custom Action  Ball Head Mount  CNC Aluminum Lightweight Secure Locking for Outdoor Sports Photography
https://www.alibaba.com/product-detail/New-Rear-Camera-Assembly-for-LR5_1601651555584.html?priceId=69a84455cb644cf789eb0b938ff23400,https://s.alicdn.com/@sc04/kf/H1c2aee7a59914bc3bc473c9c8c11858dU.jpg_300x300.jpg,$110-149,New Rear  Assembly for LR5 L405 L494 LR105215 LR081452 T2R36840 T4A18015 Universal Fitment 1 Year Warranty
https://www.alibaba.com/product-detail/Precision-CNC-Milled-Stainless-Steel-Camera_1601386729122.html?priceId=69a84455cb644cf789eb0b938ff23400,https://s.alicdn.com/@sc04/kf/Hd4aeb0f61c5441d1ada2b2376f9e6e30x.png_300x300.png,$0.60-1,Precision CNC Milled Stainless Steel  Mounts Anodized Aluminum Surface for Photography Gear Drill Type
https://www.alibaba.com/product-detail/Original-Gimbal-Camera-Assembly-Lens-Shaft_1601522714380.html?priceId=69a84455cb644cf789eb0b938ff23400,https://s.alicdn.com/@sc04/kf/Hca97ce65e2094064b9c22aa527034e97B.jpg_300x300.jpg,$108-113,Original Gimbal  Assembly Lens Shaft Arm Repair Accessories Spare  for DJ I Mini 3 PRO RC Drone Quadcopter
https://www.alibaba.com/product-detail/C-20T-Universal-Joint-19mm-Camera_1601614198673.html?priceId=69a84455cb644cf789eb0b938ff23400,https://s.alicdn.com/@sc04/kf/H85e0f1ded06e478795e069db892d5589i.png_300x300.png,$75-95,"C-20T Universal Joint 19mm  Mount, Compatible with DJI O3/WalkSnail CADDX, Fixed-Wing/FPV Racing Drone"
https://www.alibaba.com/product-detail/Hot-Sale-Multi-funtional-Mini-Camera_1601563897949.html?priceId=69a84455cb644cf789eb0b938ff23400,https://s.alicdn.com/@sc04/kf/H9640d477185347ed85a0658ca965a90b8.png_300x300.png,$1.36-3,Hot Sale Multi-funtional Mini  Housing Custom Cnc Aluminum  for Electronic
https://www.alibaba.com/product-detail/Camera-Accessories-Universal-Camera-Quick-Release_1601581696478.html?priceId=69a84455cb644cf789eb0b938ff23400,https://s.alicdn.com/@sc04/kf/H880aebba2f6849c8b4b7c70d96ca93103.jpg_300x300.jpg,$2.75-3.19,Accessories Universal  Quick Release Board L-shaped Bracket Forming Slider Stabilizer Nikon Canon
https://www.alibaba.com/product-detail/10-05-02-0085-EFT-Camera_1601661830791.html?priceId=69a84455cb644cf789eb0b938ff23400,https://s.alicdn.com/@sc04/kf/H415e11325608432fac877fbca102b0a7I.jpg_300x300.jpg,$4,10.05.02.0085 EFT  Fixing  EP Series/1pc for Agricultural Drone Frame  Cost-effective Rc Helicopter Mini
https://www.alibaba.com/product-detail/2D-Industrial-Camera-CMOS-Sensor-Distortion_1601420757981.html?priceId=69a84455cb644cf789eb0b938ff23400,https://s.alicdn.com/@sc04/kf/H47efa9ee83704af4ab6c20b18ea4fe38m.png_300x300.png,"$22,800-24,000",2D Industrial  CMOS Sensor Distortion-free Image Customizable Parameters Large Area Scan Detection  Surface
https://www.alibaba.com/product-detail/Night-Vision-Google-Optical-Optimal-Parts_1601637454733.html?priceId=69a84455cb644cf789eb0b938ff23400,https://s.alicdn.com/@sc04/kf/H83beacbf0e1d4ccc8fc54c9784d3aec1N.jpg_300x300.jpg,$0.69-0.93,Night Vision Google Optical Optimal  OEM  Components CNC Precision Machining Services Stainless Steel Machining
https://www.alibaba.com/product-detail/Industrial-Outdoor-Customized-Camera-Housing-Accessories_1601696255319.html?priceId=69a84455cb644cf789eb0b938ff23400,https://s.alicdn.com/@sc04/kf/H5d0ab5a21184411a92d75ba5bbf3509d7.png_300x300.png,$0.90-1.90,Industrial Outdoor Customized  Housing Accessories with CNC Machining and Aluminum Material Turning Processing
https://www.alibaba.com/product-detail/4-8-Sizes-Durable-Diecasting-Material_1601294115628.html?priceId=69a84455cb644cf789eb0b938ff23400,https://s.alicdn.com/@sc04/kf/Hd9024a427c52424392f027d4edec38f7B.jpg_300x300.jpg,$16-27.85,"4""-8"" Sizes Durable Diecasting Material Easy Repair Replacement CCTV Spare  Compatible with HIK Vision PTZ/Dome"
https://www.alibaba.com/product-detail/Custom-Anodized-Black-Aluminium-Cnc-Machining_1601682018613.html?priceId=69a84455cb644cf789eb0b938ff23400,https://s.alicdn.com/@sc04/kf/H05631a5caa154e7897ccfabd7b192097f.png_300x300.png,$0.20-1,Custom Anodized Black Aluminium Cnc Machining  Lenses Spare  Machining Services for Photography Accessories
https://www.alibaba.com/product-detail/Competitive-Priced-CNC-Machining-of-Stainless_1601386148781.html?priceId=69a84455cb644cf789eb0b938ff23400,https://s.alicdn.com/@sc04/kf/H7f1c3a5d7f064c309b5831e9c74c0a32c.jpg_300x300.jpg,$7.50-10,Competitive Priced CNC Machining of Stainless Steel  Shell  Milling for  Metal & Metallurgy Machinery
https://www.alibaba.com/product-detail/High-Quality-Replacement-Front-Camera-for_1600608824566.html?priceId=69a84455cb644cf789eb0b938ff23400,https://s.alicdn.com/@sc04/kf/H29ec343eaed742658f118199a50cc02da.jpg_300x300.jpg,$5.20,High Quality Replacement Front  for Samsung S21 Ultra Small
https://www.alibaba.com/product-detail/F100-parts-repair-as-is-New_1601653388943.html?priceId=69a84455cb644cf789eb0b938ff23400,https://s.alicdn.com/@sc04/kf/Hab0ee9e3d4af47e1aebf2f02e6312c20P.jpg_300x300.jpg,"$500-3,000",F100 */repair* as is New Original Ready Stock Industrial Automation Pac Dedicated Plc Programming Controller
https://www.alibaba.com/product-detail/OEM-Customized-CNC-Camera-Equipment-Clamps_1600843321948.html?priceId=69a84455cb644cf789eb0b938ff23400,https://s.alicdn.com/@sc04/kf/H48de70d764c540a1b94ab4f4c70c331aR.jpg_300x300.jpg,$1-3,OEM Customized CNC  Equipment Clamps Adapter   and Selfie Stick Clamp Adapter Components Metal Clamp Accessories
https://www.alibaba.com/product-detail/Injection-Molded-Camera-Lens-Barrel-Fine_1601663237461.html?priceId=69a84455cb644cf789eb0b938ff23400,https://s.alicdn.com/@sc04/kf/H949aa5acdadd4771b6ea01a10ccc26114.jpg_300x300.jpg,$0.68,Injection Molded  Lens Barrel Fine Thread Integrated Mold for  Lens One-stop Injection Molding OEM Brand CN/GUA
https://www.alibaba.com/product-detail/Second-Hand-Original-Grados-Camara-Insta360_1600988991104.html?priceId=69a84455cb644cf789eb0b938ff23400,https://s.alicdn.com/@sc04/kf/Haa7ca98392564d11aa1ade4ede3e73e5u.png_300x300.png,$30-125,Second Hand Original Grados Camara Insta360 rs Lens Guard Battery Dive case Accessories Insta X3 360 One X2 360
https://www.alibaba.com/product-detail/Insta360-Aluminium-Quick-Release-Mount-for_1601258881608.html?priceId=69a84455cb644cf789eb0b938ff23400,https://s.alicdn.com/@sc04/kf/H4ad892c061614d7592d038ffea063aa9a.jpg_300x300.jpg,$22.14-22.94,Insta360 Aluminium Quick Release Mount for Insta360 Go3/GO3S With Magnetic Action  Spare
https://www.alibaba.com/product-detail/Camera-Monitoring-Equipment-3-8-Inch_1600150616738.html?priceId=69a84455cb644cf789eb0b938ff23400,https://s.alicdn.com/@sc04/kf/Hacb48f38da30413998455bf724c87586g.jpg_300x300.jpg,$0.30-0.36,Monitoring Equipment 3/8 Inch  Screw Knurled Mounting Plastic Thumb Screws Bracket  Screw
https://www.alibaba.com/product-detail/YongLi-BJ-920A6-HD-SPI-VGA_1601570540433.html?priceId=69a84455cb644cf789eb0b938ff23400,https://s.alicdn.com/@sc04/kf/Hf2b3ef3dcbfd459a90603d46bbbf8264z.jpg_300x300.jpg,$1.29-1.90,YongLi BJ-920A6 HD SPI VGA Resolution DJI Drone Mavic Air2s Gimbal Lens Repair   Module
https://www.alibaba.com/product-detail/13million-Pixels-5MP-16MP-PCBA-High_1600934321788.html?priceId=69a84455cb644cf789eb0b938ff23400,https://s.alicdn.com/@sc04/kf/H9022d64493c041f38f7b8eb3af4a3c819.jpg_300x300.jpg,$16-20,13million Pixels 5MP 16MP PCBA High Definition Spare  HD Module USB Scanner
https://www.alibaba.com/product-detail/OEM-Custom-CNC-Parts-High-Quality_1600216863812.html?priceId=69a84455cb644cf789eb0b938ff23400,https://s.alicdn.com/@sc04/kf/H45768a3a830249be85c68bd2a3b33cdaG.jpg_300x300.jpg,$0.30-1,OEM Custom CNC  High Quality Aluminum Alloy Broaching with Stainless Steel Screw for  for Photographic Equipment
https://www.alibaba.com/product-detail/New-Original-Ready-Stock-Smart-View_1601676164334.html?priceId=69a84455cb644cf789eb0b938ff23400,https://s.alicdn.com/@sc04/kf/Heb902bfb821c4f50a5410989195307c46.jpg_300x300.jpg,$119.99,New Original Ready Stock Smart View   or Repair
https://www.alibaba.com/product-detail/1-4-3-8-Camera-Screw_1601678334789.html?priceId=69a84455cb644cf789eb0b938ff23400,https://s.alicdn.com/@sc04/kf/H9e4d0f70f5644bffa953424a42f5b66dc.jpg_300x300.jpg,$0.03-0.10,1/4 3/8  Screw D Ring Handle Mount Adapter with Rope for Shoulder Sling Neck Strap DSLR Tripod Photo Studio Accessories
https://www.alibaba.com/product-detail/FP100-Micro-FPV-Camera-Drone-0_1601676242753.html?priceId=69a84455cb644cf789eb0b938ff23400,https://s.alicdn.com/@sc04/kf/H27ed6594f7c344e68f5086f3dc10dc1d9.jpg_300x300.jpg,$12-14,FP100 Micro FPV  Drone 0.000001Lux 2.1mm Lens 16-9/4-3 NTSC/PAL Switchable Replacement Lens FPV  RC  Accs
https://www.alibaba.com/product-detail/High-Precision-Custom-Processing-Anodized-Aluminum_1601209568561.html?priceId=69a84455cb644cf789eb0b938ff23400,https://s.alicdn.com/@sc04/kf/H0ec2629ce32645f7b745e2cc676e85afa.jpg_300x300.jpg,$0.10-0.50,High Precision Custom Processing Anodized Aluminum Custom Logo  Strict Tolerance Precision Action  Accessories
https://www.alibaba.com/product-detail/Custom-Drone-Gimbal-CNC-Machined-Parts_1601601348244.html?priceId=69a84455cb644cf789eb0b938ff23400,https://s.alicdn.com/@sc04/kf/H95214cbb0f264f0589880aab945128d1Y.jpg_300x300.jpg,$0.05-1,Custom Drone Gimbal CNC Machined   Stabilizer Mounts Damping Components Aluminum Alloy Stainless Steel Wire EDM
https://www.alibaba.com/product-detail/Custom-Smartphone-Lens-Injection-Molded-Components_1601638946963.html?priceId=69a84455cb644cf789eb0b938ff23400,https://s.alicdn.com/@sc04/kf/Hd8cd87e3e0fd490d8de5773bfeafcc94u.jpg_300x300.jpg,$0.20-0.99,Custom Smartphone Lens Injection Molded Components - OEM/ODM Acceptable for  Module
https://www.alibaba.com/product-detail/Rear-Camera-for-Samsung-Galaxy-A55_1601601305561.html?priceId=c9bbf07968174e02a12d6e2ca755a910,https://s.alicdn.com/@sc04/kf/H80ae9dc0680e46069bf18b5547f2ae52z.jpg_300x300.jpg,$9.90,Rear  for Samsung Galaxy A55 5G A556 Back  Module Backside Flex Mobile Phone
https://www.alibaba.com/product-detail/100-Original-Front-Camera-for-iPhone_1601369870040.html?priceId=c9bbf07968174e02a12d6e2ca755a910,https://s.alicdn.com/@sc04/kf/Hbdfed6a770ee40b59c63ab67c0062e70r.png_300x300.png,$1.32-2.26,100% Original Front  for iPhone 12 12MINI 12Pro 12ProMax Small Facing Electronics Repair  for iPhone 12 Small
https://www.alibaba.com/product-detail/1-4-Camera-Screw-Camera-Photo_60874172018.html?priceId=c9bbf07968174e02a12d6e2ca755a910,https://s.alicdn.com/@sc04/kf/HTB1VqWBaTHuK1RkSndVq6xVwpXaM.jpg_300x300.jpg,$6,1/4  Screw  Photo Accessories
https://www.alibaba.com/product-detail/High-Quality-Quick-Release-Clamp-and_1601389613237.html?priceId=c9bbf07968174e02a12d6e2ca755a910,https://s.alicdn.com/@sc04/kf/Heaccad9e164e448481e1f100377ec887b.jpg_300x300.jpg,$13.50,High Quality Quick Release Clamp and Plate Aluminum Alloy Tripod Spare  for DSLR  Accessories
https://www.alibaba.com/product-detail/Cameras-Strap-Accessories-Part-Strong-Nylon_1601636471905.html?priceId=c9bbf07968174e02a12d6e2ca755a910,https://s.alicdn.com/@sc04/kf/Hd8ad2b0666104d92bed43c7b7ae5564fP.jpg_300x300.jpg,$5.19,Cameras Strap Accessories  Strong Nylon  Rope Mountaineering  Shoulder Neck Strap Belt SLR
https://www.alibaba.com/product-detail/Signal-Cable-Flex-Flexible-Loop-for_1600223880041.html?priceId=c9bbf07968174e02a12d6e2ca755a910,https://s.alicdn.com/@sc04/kf/H8c1f6b940fc34ec7985adcb614394119o.jpg_300x300.jpg,$7.34,Signal Cable Flex Flexible Loop for DJI Mavic Pro Drone  Video Transmit Wire Gimbal Mounting Plate Repair  Accessory
https://www.alibaba.com/product-detail/Custom-Matt-Finish-Digital-Camera-Rapid_62324973771.html?priceId=c9bbf07968174e02a12d6e2ca755a910,https://s.alicdn.com/@sc04/kf/Hc7f8410d732b45daa7fa080a3b3f841aV.jpg_300x300.jpg,$9,Custom Matt Finish Digital  Rapid Prototyping Aluminum Prototype Plastic  Jewelry Vacuum Casting Prototypes
https://www.alibaba.com/product-detail/Universal-DSLR-Camera-1-4-Inch_1600978571158.html?priceId=c9bbf07968174e02a12d6e2ca755a910,https://s.alicdn.com/@sc04/kf/H51fe19e654f44f24926db9ae21e614fdl.jpg_300x300.jpg,$2.54-3.26,Universal DSLR  1/4 Inch Screw Swiss Vertical L Plate Mount Quick Release L Bracket for Nikon Canon Sony
