product_url,image_url,price,title
https://www.alibaba.com/product-detail/Custom-Electronic-Factory-Monitoring-Network-Camera_1601224713530.html?priceId=a5cf1ac1fdae4146bfc2a672833ab383,https://s.alicdn.com/@sc04/kf/He21fe61e46874457b41247eb0c3afe8eH.jpg_300x300.jpg,$0.20-19.80,Custom Electronic Factory Monitoring Network  Assembly Harness
https://www.alibaba.com/product-detail/The-Camera-Wrist-Strap-Is-Suitable_1601625958290.html?priceId=a5cf1ac1fdae4146bfc2a672833ab383,https://s.alicdn.com/@sc04/kf/H76bddf8c473d4a42b09bc5c13f21c9d6W.jpg_300x300.jpg,$6,The  Wrist Strap Is Suitable for Micro SLR Canon Nikon Sony Fuji Decompression Anti-Skid Compatible PD
https://www.alibaba.com/product-detail/1-600kg-3m-Length-PES-Cam_1601118232803.html?priceId=a5cf1ac1fdae4146bfc2a672833ab383,https://s.alicdn.com/@sc04/kf/H0c6b30141b4548d2b3bb7d3178012f55z.jpg_300x300.jpg,$4.70,"1"" 600kg 3m Length PES Cam Buckle Tie Down Strap 4PK with S Hook"
https://www.alibaba.com/product-detail/Second-hand-Cabezal-de-impresions-Original_1601637551498.html?priceId=a5cf1ac1fdae4146bfc2a672833ab383,https://s.alicdn.com/@sc04/kf/H3963b3097d6f4ba2b64dd82498c76dc9K.jpg_300x300.jpg,$140,Second-hand Cabezal de impresions Original F177000 DX7
https://www.alibaba.com/product-detail/1-Inch-500kg-3m-Length-PES_1601113192533.html?priceId=a5cf1ac1fdae4146bfc2a672833ab383,https://s.alicdn.com/@sc04/kf/H150457d924c241ebaf789a6dc0509bb1J.jpg_300x300.jpg,$1.20,1 Inch 500kg 3m Length PES Cam Buckle Strap 2PK
https://www.alibaba.com/product-detail/Camera-Strap-Quick-Detachment-DSLR-Camera_1601427949069.html?priceId=a5cf1ac1fdae4146bfc2a672833ab383,https://s.alicdn.com/@sc04/kf/Hb5c1f3c4fb0f4733959f868bf8c274d2x.jpg_300x300.jpg,$7-10,Strap Quick Detachment DSLR  Strap Suitable for Nikon Z8 Fuji Canon R50 Sony Leica  Strap Compatible with PD
https://www.alibaba.com/product-detail/1-500kg-4m-Length-PES-Heavy_1601118585092.html?priceId=a5cf1ac1fdae4146bfc2a672833ab383,https://s.alicdn.com/@sc04/kf/H2651decdfee448f2b37b95c1f4d27661E.jpg_300x300.jpg,$1.93,"1"" 500kg 4m Length PES Heavy Duty Cam Buckle Strap 4PK"
https://www.alibaba.com/product-detail/Camera-Strap-Compatible-with-DSLR-5D4_1601394653268.html?priceId=a5cf1ac1fdae4146bfc2a672833ab383,https://s.alicdn.com/@sc04/kf/Hd359055192124726baf939c20794e6a5v.jpg_300x300.jpg,$8-15,Strap Compatible with DSLR 5D4 Fujifilm XT50 Mirrorless ZFC Z6 A7M5 Quick-release Shoulder Strap Compatible With PD
https://www.alibaba.com/product-detail/4m-to-16m-Pneumatic-Telescoping-Mast_1601425252131.html?priceId=a5cf1ac1fdae4146bfc2a672833ab383,https://s.alicdn.com/@sc04/kf/Hc37fb32370ea463dbfb385ef77147ddd6.png_300x300.png,$569.24-793.26,4m to 16m Pneumatic Telescoping Mast Ground or the Vehicle Mounted for CCTV
https://www.alibaba.com/product-detail/5-Megapixel-OV5647-Camera-CMOS-Sensor_60698611995.html?priceId=a5cf1ac1fdae4146bfc2a672833ab383,https://s.alicdn.com/@sc04/kf/HTB145xLaUvrK1RjSszfq6xJNVXa5.jpg_300x300.jpg,$1.69,5 Megapixel OV5647  CMOS Sensor
https://www.alibaba.com/product-detail/For-Canon-SX720-HS-SX610-HS_1601637580166.html?priceId=a5cf1ac1fdae4146bfc2a672833ab383,https://s.alicdn.com/@sc04/kf/Hb8283286f6b349569a9377443dab7c2bf.jpg_300x300.jpg,$21.51,For Canon SX720 HS / SX610 HS / SX620 HS Original LCD Display Screen for Canon  LCD Spare   LCD Screen
https://www.alibaba.com/product-detail/Wholesale-Phone-Spare-Parts-Original-Camera_1601562369451.html?priceId=a5cf1ac1fdae4146bfc2a672833ab383,https://s.alicdn.com/@sc04/kf/H37fd79fe797f4e05a5d9771827b99a04j.jpg_300x300.jpg,$65.37,Wholesale Phone Spare  Original  Set for Samsung Galaxy S25 Ultra SM-S938B
https://www.alibaba.com/product-detail/Original-Gimbal-Main-Camera-Replacement-for_1601625887131.html?priceId=a5cf1ac1fdae4146bfc2a672833ab383,https://s.alicdn.com/@sc04/kf/H4691d81933e14831bcad6f8baf9063c7X.jpg_300x300.jpg,$20.89,Original Gimbal Main  Replacement for DJI Mavic Air 2S Drone  Module Repair  Accessories
https://www.alibaba.com/product-detail/For-Sony-A6600-Camera-Replacement-Double_1601668548018.html?priceId=a5cf1ac1fdae4146bfc2a672833ab383,https://s.alicdn.com/@sc04/kf/H10966b60373a45cdaff56a376da735c8w.jpg_300x300.jpg,$49.85,For Sony A6600  Replacement Double NP-FZ100 Batteries Durable ABS Portable  Battery Grip Handle Accessory
https://www.alibaba.com/product-detail/ODM-Factory-12MP-Auto-Focus-Camera_1601160957422.html?priceId=a5cf1ac1fdae4146bfc2a672833ab383,https://s.alicdn.com/@sc04/kf/Hd6f94a3fd2f24536a39ef04e6493bfdeQ.jpg_300x300.jpg,$27,ODM Factory 12MP Auto Focus  Module for Smart Terminal Devices
https://www.alibaba.com/product-detail/Popular-Cctv-Camera-M12-Lens-5_1600991401767.html?priceId=a5cf1ac1fdae4146bfc2a672833ab383,https://s.alicdn.com/@sc04/kf/H863e0fddded84727aec58c2361d3cea1X.png_300x300.png,$2.70,Popular Cctv  M12 Lens 5.3mm F2.2 Ytot Security  Lens
https://www.alibaba.com/product-detail/For-Creality-K2-Plus-Nozzle-Cavity_1601440669957.html?priceId=a5cf1ac1fdae4146bfc2a672833ab383,https://s.alicdn.com/@sc04/kf/H9994a4e087b04f10ad792f2c78eab3bfD.jpg_300x300.jpg,$5.70,For Creality K2 Plus Nozzle Cavity  Original Replacement  for Creality K2 Plus 3D Printer Accesoires
https://www.alibaba.com/product-detail/ISO13485-Certified-Endoscope-OEM-ODM-Factory_1601690938333.html?priceId=a5cf1ac1fdae4146bfc2a672833ab383,https://s.alicdn.com/@sc04/kf/H3e2a0cc9bdfb47929160cb1eed769210Z.jpg_300x300.jpg,$85,ISO13485 Certified Endoscope OEM/ODM Factory 1.5mm OVM6946  Module for Disposable Urological Endoscope
https://www.alibaba.com/product-detail/Mamen-Camera-Accessories-for-Nikon-Z6_1600196911605.html?priceId=a5cf1ac1fdae4146bfc2a672833ab383,https://s.alicdn.com/@sc04/kf/H5c1d0c6b88cd4f4a98a12c4cad996f1aA.png_300x300.png,$22.90,Mamen  Accessories for Nikon-Z6/Z7 Dslr From China Supply Aluminium Alloy  Cage
https://www.alibaba.com/product-detail/Low-cost-0-3mp-1-10_1600896950991.html?priceId=a5cf1ac1fdae4146bfc2a672833ab383,https://s.alicdn.com/@sc04/kf/Hd6c4db964a0b4d9b8ee38415b00ab9632.jpg_300x300.jpg,$5.58,Low cost 0.3mp 1/10 inch GC0310 GC0309 GC0308 VGA CMOS image sensor mini micro mipi usb  module 640x480 Low power
https://www.alibaba.com/product-detail/5MP-DJI-Drone-Mavic-Air2s-Gimbal_1601364329698.html?priceId=a5cf1ac1fdae4146bfc2a672833ab383,https://s.alicdn.com/@sc04/kf/H5f00247c2dd84fa7894decd584f67b00c.jpg_300x300.jpg,$55,5MP DJI Drone Mavic Air2s Gimbal Lens Repair  HD MIPI  Module
https://www.alibaba.com/product-detail/Kitway-Original-Accessories-Combo-Kit-for_1600351087473.html?priceId=a5cf1ac1fdae4146bfc2a672833ab383,https://s.alicdn.com/@sc04/kf/H915537c42e78449c96fb0809495c03983.jpg_300x300.jpg,$12.65,Kitway Original Accessories Combo Kit for Hero 10 9 12 Action & Sports  Accessory Set
https://www.alibaba.com/product-detail/Original-Used-Gimbal-Camera-Lens-Housing_1600109820062.html?priceId=a5cf1ac1fdae4146bfc2a672833ab383,https://s.alicdn.com/@sc04/kf/H78e8cc990e764478a4742aa66aa032c8Z.jpg_300x300.jpg,$23-26.70,Original Used Gimbal  Lens Housing Shell Cover Head Assembly for DJI Mavic Mini Drone Gimbal Replacement Repair
https://www.alibaba.com/product-detail/Original-4K-Gimbal-Camera-for-DJI_1601613597014.html?priceId=a5cf1ac1fdae4146bfc2a672833ab383,https://s.alicdn.com/@sc04/kf/H3a0a8406cf4d44098e98bfa86ec98ce6I.jpg_300x300.jpg,$95-102,Original 4K Gimbal  for DJI Mini 2 Gimbal Repair  Drone Replacement Repair Service Spare
https://www.alibaba.com/product-detail/Original-Repair-Parts-For-DJI-Mini_1601589488697.html?priceId=a5cf1ac1fdae4146bfc2a672833ab383,https://s.alicdn.com/@sc04/kf/Hd423d301c6ff40e4abf345edab70645dy.jpg_300x300.jpg,$0.90-1,Original Repair  For DJI Mini 3 Pro Gimbal  & Housing Shell/Signal Cable Test Tool/Yaw Roll Motor/ Rubber/Lens Glass
https://www.alibaba.com/product-detail/Gimbal-Shell-Custom-for-DJI-Mavic_1601023135531.html?priceId=a5cf1ac1fdae4146bfc2a672833ab383,https://s.alicdn.com/@sc04/kf/H6ffa65eaa86d43dda1bc9111638d9bfec.jpg_300x300.jpg,$5.14-8.02,Gimbal Shell Custom for DJI Mavic Mini 3 Pro  Frame Gimbal Arm Aluminum Drone Accessories
https://www.alibaba.com/product-detail/OEM-Custom-CNC-Machining-Optical-Instrument_1601513000846.html?priceId=a5cf1ac1fdae4146bfc2a672833ab383,https://s.alicdn.com/@sc04/kf/H8324dfbedc7249998b81f1f263a68cd8o.png_300x300.png,$0.59-2.59,OEM Custom CNC Machining Optical Instrument Sparepart  Lens Black Anodized Aluminum Copper Stainless Wire EDM Turning
https://www.alibaba.com/product-detail/Custom-6067-6061-Aluminum-Parts-Camera_1600968433235.html?priceId=a5cf1ac1fdae4146bfc2a672833ab383,https://s.alicdn.com/@sc04/kf/H027d6c95a75d4aadbd8817b1a9ee1c81t.jpg_300x300.jpg,$10-30,Custom 6067 6061 Aluminum   Model Enclosure High Precision CNC Anodized Aluminum CNC Machining
https://www.alibaba.com/product-detail/Custom-CNC-Machining-Housings-of-Robot_1601690521364.html?priceId=a5cf1ac1fdae4146bfc2a672833ab383,https://s.alicdn.com/@sc04/kf/Hd2f497c304fa4e55810c466cc133ccfbZ.png_300x300.png,$2.50-3,Custom CNC Machining Housings of Robot  Lens Smart Sweeper Dome IPC  Module | Pan-Tilt Shake Head Machine Vision
https://www.alibaba.com/product-detail/Custom-Precision-Hardware-Fabrication-Services-Anodized_11000018980980.html?priceId=a5cf1ac1fdae4146bfc2a672833ab383,https://s.alicdn.com/@sc04/kf/H2fee3880ac8e44ef832cf24daeae3226A.jpg_300x300.jpg,$2-5,Custom Precision Hardware Fabrication Services Anodized Aluminum Die-Cast  Housing
https://www.alibaba.com/product-detail/Bulk-Travel-Camera-EVA-Foam-Lining_1601640028310.html?priceId=a5cf1ac1fdae4146bfc2a672833ab383,https://s.alicdn.com/@sc04/kf/H1f980acbd13740a5a2385b35a9f143519.jpg_300x300.jpg,$1.18-1.65,"Bulk Travel  EVA Foam Lining Custom Shape Shockproof Inner Liner, Fit for  Body & Handle Accessories Wholesale"
https://www.alibaba.com/product-detail/Hot-Brand-Color-Sorter-Parts-Camera_1601379984480.html?priceId=a5cf1ac1fdae4146bfc2a672833ab383,https://s.alicdn.com/@sc04/kf/Hefdad939632e4d70969be1f0b54afb96S.png_300x300.png,$19-25,Hot Brand Color Sorter   Boards with Good Quality
https://www.alibaba.com/product-detail/CNC-Precision-Machined-Black-Aluminium-Camera_1601567359130.html?priceId=a5cf1ac1fdae4146bfc2a672833ab383,https://s.alicdn.com/@sc04/kf/H5c1b9526fb184c69a9950949538807a4W.jpg_300x300.jpg,$0.10-0.85,CNC Precision Machined Black Aluminium  Lens Adapter Ring Optics Photography Equipment Custom  Milling Turning
https://www.alibaba.com/product-detail/Original-Aperture-Unit-Accessories-for-Sony_1601376077335.html?priceId=a5cf1ac1fdae4146bfc2a672833ab383,https://s.alicdn.com/@sc04/kf/H179ddea00fd54ee6b05d79b8e4f065fbr.jpg_300x300.jpg,$25,Original Aperture Unit Accessories for Sony NX100 X70 Lens Shutter Unit Repair
https://www.alibaba.com/product-detail/High-Quality-Rear-Main-Camera-Module_1601603258377.html?priceId=a5cf1ac1fdae4146bfc2a672833ab383,https://s.alicdn.com/@sc04/kf/H9c2d9c4132984486be428a5c5bc8a74bp.jpg_300x300.jpg,$0.99-1.39,High Quality Rear Main  Module  Repair for Samsung Galaxy A20s
https://www.alibaba.com/product-detail/High-Quality-Strict-Tolerance-Cnc-Machining_1601661125787.html?priceId=a5cf1ac1fdae4146bfc2a672833ab383,https://s.alicdn.com/@sc04/kf/Hd555f767b50f4ee68f57158a9b940a7bN.jpg_300x300.jpg,$0.20-0.50,High Quality Strict Tolerance Cnc Machining   Made in China at Best Price
https://www.alibaba.com/product-detail/Mini-Tripod-Ball-Head-360-Degree_1601389597257.html?priceId=a5cf1ac1fdae4146bfc2a672833ab383,https://s.alicdn.com/@sc04/kf/H2729cefced314509812d5f0dc9ab5acfy.jpg_300x300.jpg,$4.60,"Mini Tripod Ball Head 360 Degree Rotation Aluminum Alloy  Mount Adapter 1/4"" Screw Thread 25mm Ball Sphere 5kg Load"
https://www.alibaba.com/product-detail/Factory-Custom-Die-Casting-Aluminium-Parts_1601301515784.html?priceId=a5cf1ac1fdae4146bfc2a672833ab383,https://s.alicdn.com/@sc04/kf/H290f8554fbab4f08b43b3a55c82694e6A.jpg_300x300.jpg,$0.12-0.22,Factory Custom Die Casting Aluminium  Adjustable Black Power Coated  Mount Adapter with Mount Base
https://www.alibaba.com/product-detail/HS-HS-2-8-A-large_1601279640529.html?priceId=a5cf1ac1fdae4146bfc2a672833ab383,https://s.alicdn.com/@sc04/kf/Hd9a41e807e1f4450a8f2f7c16a8631c8y.jpg_300x300.jpg,$3.10,"HS HS-2.8-A-large Angle 3MP 1/2.9"" Sensor 110 Degree Focal Length 2.4mm M12 Dedicated Module CCTV Lenses  Internal Unit"
https://www.alibaba.com/product-detail/CNC-Machining-Camera-Parts-Customized-Anodized_1601278092476.html?priceId=a5cf1ac1fdae4146bfc2a672833ab383,https://s.alicdn.com/@sc04/kf/H5130414583e54120bb17181b48eec1bdz.png_300x300.png,$5-6,CNC Machining   Customized Anodized Aluminium  Square Universal Buckle Mount
https://www.alibaba.com/product-detail/High-Quality-2MP-1-2-9_1601267855859.html?priceId=a5cf1ac1fdae4146bfc2a672833ab383,https://s.alicdn.com/@sc04/kf/H276ee72917ef488eb49bb16812bb7ce2v.jpg_300x300.jpg,$2-3,"High Quality 2MP 1/2.9\"" IMX323 EFL 4.42mm CCTV  Lens M8 M9 M12 F2.4 Wide Angle Lens IR Block for 4K High Definition"
https://www.alibaba.com/product-detail/CNC-OEM-Customized-Aluminum-Camera-Components_1601043565160.html?priceId=a5cf1ac1fdae4146bfc2a672833ab383,https://s.alicdn.com/@sc04/kf/Hb369f0e4996041de8ca9906852c91324l.jpg_300x300.jpg,$2,CNC OEM Customized Aluminum  Components with Bead Blasting and Black Anodized
https://www.alibaba.com/product-detail/Precision-Custom-5-6-Axis-OEM_1601032610419.html?priceId=a5cf1ac1fdae4146bfc2a672833ab383,https://s.alicdn.com/@sc04/kf/H089a06ba14324475b632a0a31d22b125A.jpg_300x300.jpg,$0.80,Precision Custom 5 6 Axis OEM Machining Service Center Custom Aluminum Underwater   CNC Machining
https://www.alibaba.com/product-detail/OEM1080P-IMX307-OV2710-OV7251-IPC-IMX585_1600706993191.html?priceId=a5cf1ac1fdae4146bfc2a672833ab383,https://s.alicdn.com/@sc04/kf/H8a635143b3e64cf98d28ff16afb70ea9e.png_300x300.png,$5.80-8.90,OEM1080P IMX307 OV2710 OV7251 IPC IMX585 MI2010 SC133HGS SC035HGS MI2010 OV2710 OV2312 MT9V034  Module
https://www.alibaba.com/product-detail/Half-Round-Mirrorless-Camera-Lens-Connector_1600359134971.html?priceId=a5cf1ac1fdae4146bfc2a672833ab383,https://s.alicdn.com/@sc04/kf/H8864facd80474990b76af4cfdc8fd946w.jpg_300x300.jpg,$1.25-1.80,Half Round Mirrorless  Lens Connector Bayonet
https://www.alibaba.com/product-detail/OEM-Aluminum-Alloy-Die-Casting-Parts_1600260209033.html?priceId=a5cf1ac1fdae4146bfc2a672833ab383,https://s.alicdn.com/@sc04/kf/H298b4bbdafa94a7bbf330726d66d9cd7q.jpg_300x300.jpg,$18.30-21.50,OEM Aluminum Alloy Die Casting  Good Price Zinc Alloy  Shell for Surveillance Cameras Casting Services
https://www.alibaba.com/product-detail/Customized-CNC-Machining-Parts-Black-Steel_62111148314.html?priceId=a5cf1ac1fdae4146bfc2a672833ab383,https://s.alicdn.com/@sc04/kf/HLB1UWe1U6DpK1RjSZFrq6y78VXa4.jpg_300x300.jpg,"$9,700-10,000",Customized CNC Machining  Black Steel
https://www.alibaba.com/product-detail/Car-Front-Camera-Custom-CNC-Machining_60792708526.html?priceId=a5cf1ac1fdae4146bfc2a672833ab383,https://s.alicdn.com/@sc04/kf/HTB1SWE8dUD.BuNjt_ioq6AKEFXa6.jpg_300x300.jpg,$0.45-0.75,Car Front  Custom CNC Machining Services Automotive Components Stainless Steel Aluminum Alloy Anodized
https://www.alibaba.com/product-detail/SKYZONE-m2-Super-WDR-1-3_10000034517250.html?priceId=a5cf1ac1fdae4146bfc2a672833ab383,https://s.alicdn.com/@sc04/kf/S5d32fda0c8244773a560aa656dcb51fdR.jpg_300x300.jpg,$12.34,SKYZONE m2 Super WDR 1_3 Inch Micro FPV  Essential Drone  for Enhanced Imaging Manual Fulfillment Service
https://www.alibaba.com/product-detail/Hot-Foxeer-Predator-5-Mini-Camera_1601677810548.html?priceId=a5cf1ac1fdae4146bfc2a672833ab383,https://s.alicdn.com/@sc04/kf/Ha3a438ef023a463881f406e839301695l.jpg_300x300.jpg,$31.20-34.50,Hot Foxeer Predator 5 Mini  FPV Drone
https://www.alibaba.com/product-detail/Black-Aluminum-Camera-Lens-Shell-Processing_1601673007763.html?priceId=a5cf1ac1fdae4146bfc2a672833ab383,https://s.alicdn.com/@sc04/kf/H6ef7ddb87924413cb361107ec6be879du.png_300x300.png,$0.10-0.50,Black Aluminum  Lens Shell Processing  CNC Turning Bushing Housing  Accessories
https://www.alibaba.com/product-detail/Factory-OEM-Custom-Cnc-Machining-Milling_1601667480396.html?priceId=a5cf1ac1fdae4146bfc2a672833ab383,https://s.alicdn.com/@sc04/kf/Hb0312a00508d4ad58e2fff307329db6b1.jpg_300x300.jpg,$0.60-1.90,Factory OEM Custom Cnc Machining Milling Drilling Painting Aluminum  case
https://www.alibaba.com/product-detail/SMT-MACHINE-PARTS-Mpm-UP2000-CCD_1601411470600.html?priceId=a5cf1ac1fdae4146bfc2a672833ab383,https://s.alicdn.com/@sc04/kf/H39be6b255fc546b19be9aabc5cda01fb2.jpg_300x300.jpg,$80-100,SMT MACHINE  Mpm UP2000 CCD  Cable P4803
https://www.alibaba.com/product-detail/CustomManufacturer-Custom-Precision-Cast-Aluminum-or_1601660858642.html?priceId=a5cf1ac1fdae4146bfc2a672833ab383,https://s.alicdn.com/@sc04/kf/Hd3f4b1eb04274ec4835f691dfcb76b88G.jpg_300x300.jpg,$0.50,CustomManufacturer Custom Precision Cast Aluminum or Zinc Alloy Die Casting  Die-Casting  Housing
https://www.alibaba.com/product-detail/Custom-CNC-Machining-Service-Machined-Camera_1601653319873.html?priceId=a5cf1ac1fdae4146bfc2a672833ab383,https://s.alicdn.com/@sc04/kf/H196a0398864443b6bb78e31c0d66d7c64.jpg_300x300.jpg,$0.50-2,Custom CNC Machining Service Machined  Head Assembly Precision CNC Turning
https://www.alibaba.com/product-detail/Used-for-ZV-E10-Mirrorless-Camera_1601641656481.html?priceId=a5cf1ac1fdae4146bfc2a672833ab383,https://s.alicdn.com/@sc04/kf/H93d49b0227d64b55b8bc4b968aa35baa2.jpg_300x300.jpg,$280-300,Used for ZV-E10 Mirrorless  4K CMOS Sensor Cheap 16-50mm Lens SD Card
https://www.alibaba.com/product-detail/FP100-PFLY-FPV-Camera-Drone-0_1601529668179.html?priceId=a5cf1ac1fdae4146bfc2a672833ab383,https://s.alicdn.com/@sc04/kf/H65c58994f750453e8611b836bca0e3d8F.jpg_300x300.jpg,$12-14,FP100 PFLY FPV  Drone 0.000001Lux 2.1mm Lens 16-9/4-3 NTSC/PAL Switchable RC  Accs
https://www.alibaba.com/product-detail/SMT-Parts-CM402-Camera-Dust-proof_1601639977065.html?priceId=a5cf1ac1fdae4146bfc2a672833ab383,https://s.alicdn.com/@sc04/kf/Hd479de1e596445858f071166d5b95c69r.jpg_300x300.jpg,$49.99,SMT  CM402  Dust-proof Lens KXF0DFAFAA0
https://www.alibaba.com/product-detail/Original-Caddx-004sl-Thermal-Imaging-Camera_1601637043364.html?priceId=a5cf1ac1fdae4146bfc2a672833ab383,https://s.alicdn.com/@sc04/kf/Hae6f189b525e4c0dba75dd1044c891eet.jpg_300x300.jpg,$379-409,Original Caddx 004sl Thermal Imaging  Infrared Band 8~12um For Rc Fpv Racing Drones Diy
https://www.alibaba.com/product-detail/Camera-Strap-Suitable-for-DSLR-Canon_1601386228641.html?priceId=378be75b4ea9425995e7f9823e4f6034,https://s.alicdn.com/@sc04/kf/H4006d36378064b4a8e12de5c4cd6ab3bR.jpg_300x300.jpg,$9-16,Strap Suitable for DSLR Canon Nikon Sony Fuji Mirrorless Quick Detachable Strap  Strap Compatible with PD
https://www.alibaba.com/product-detail/3m-to-18m-Wall-Mounted-Pneumatic_1601283861366.html?priceId=378be75b4ea9425995e7f9823e4f6034,https://s.alicdn.com/@sc04/kf/Heb26db8799c24490a8c939cbec7cb14bO.png_300x300.png,$620-800,3m to 18m Wall Mounted Pneumatic Telescopic Mast for Monitor
https://www.alibaba.com/product-detail/Camera-Hot-Shoe-Cover-Suitable-for_1601629320346.html?priceId=378be75b4ea9425995e7f9823e4f6034,https://s.alicdn.com/@sc04/kf/Hbead422500b14607a8410a5fbad9df6ac.jpg_300x300.jpg,$3,Hot Shoe Cover Suitable for Canon Nikon Fuji Long Hot Shoe Mouth Universal
https://www.alibaba.com/product-detail/Custom-Manufacturing-Factory-High-Precision-CNC_1601418194229.html?priceId=378be75b4ea9425995e7f9823e4f6034,https://s.alicdn.com/@sc04/kf/H4c34ec09544649d4887c75b5d6cd3cdfz.png_300x300.png,$4,Custom Manufacturing Factory High Precision CNC Milling Machining Stainless Steel Aluminum Alloy Mirrorless DSLR
https://www.alibaba.com/product-detail/KEYENCE-CV-S035MU-Small-Digital-Speed_1601684820959.html?priceId=378be75b4ea9425995e7f9823e4f6034,https://s.alicdn.com/@sc04/kf/H82975d3cd278444485c7725ebb4209c8u.png_300x300.png,$361-380,KEYENCE CV-S035MU Small Digital Speed Black and White  Control  of Visual System in Stock
https://www.alibaba.com/product-detail/LXC-Hot-Sale-Lens-Glass-T20P_1601651256917.html?priceId=378be75b4ea9425995e7f9823e4f6034,https://s.alicdn.com/@sc04/kf/H7699009e7f0d444788b5e1073594da8eA.jpg_300x300.jpg,$3.70-3.90,LXC Hot Sale Lens Glass T20P Repair  T40 T50 FPV  Module Accessory
https://www.alibaba.com/product-detail/Camera-Geared-Head-3-8-Screw_1601536292517.html?priceId=378be75b4ea9425995e7f9823e4f6034,https://s.alicdn.com/@sc04/kf/Ha68a22aac8d648ec894c8909d020a8dc4.jpg_300x300.jpg,$238.56,Geared Head 3/8 Screw Holes Millimeter Adjustment Aluminum Alloy 3 Axis Pan Tilt Head With Quick Release Plate
https://www.alibaba.com/product-detail/Drone-Fpv-Camera-for-T40-Drone_1601523302613.html?priceId=378be75b4ea9425995e7f9823e4f6034,https://s.alicdn.com/@sc04/kf/Hf9b420c9c3ca416ba3068932064b6a4bg.jpg_300x300.jpg,$140-161,Drone Fpv  for T40 Drone Brand New Agras T40 Agriculture Drone Spare  Spraying T20p Fpv Module Accessories
https://www.alibaba.com/product-detail/Maintenance-parts-Gimbal-Camera-PTZ-Camera_1601645902332.html?priceId=378be75b4ea9425995e7f9823e4f6034,https://s.alicdn.com/@sc04/kf/He61f73aeb41749408d1ae7c6ff6ab02ft.jpg_300x300.jpg,$254.16-276.93,Maintenance  Gimbal  PTZ  for Mini 5 Pro Drone Replacement PTZ  Repair Spare
https://www.alibaba.com/product-detail/Customized-High-Quality-CNC-Lathe-Zoom_1601516359765.html?priceId=378be75b4ea9425995e7f9823e4f6034,https://s.alicdn.com/@sc04/kf/H02ec963aad1c48e885826cc50d5945972.jpg_300x300.jpg,$0.14-0.28,Customized High-Quality CNC Lathe Zoom Ring DSLR Mirrorless Digital   For Sony Accessories
https://www.alibaba.com/product-detail/OEM-Customized-Aluminum-Plastic-CNC-Machined_1601516215354.html?priceId=378be75b4ea9425995e7f9823e4f6034,https://s.alicdn.com/@sc04/kf/H55d85be3576646ca8cc8fab07bc7d687J.jpg_300x300.jpg,$1-5,OEM Customized Aluminum Plastic CNC Machined Turning  Telescope Photography Sleeve  Case
https://www.alibaba.com/product-detail/High-Quality-Custom-Digital-Camera-Lens_1601630950987.html?priceId=378be75b4ea9425995e7f9823e4f6034,https://s.alicdn.com/@sc04/kf/H43f4d0b1fe4e4a81a7a557ef36ab676aV.jpg_300x300.jpg,$0.10-1,High Quality Custom Digital  Lens  Cnc Metal Machining Turning Milling Cnc Machining Service Aluminum Cnc
https://www.alibaba.com/product-detail/Advanced-PVD-Coated-CNC-Components-Stainless_1601504401040.html?priceId=378be75b4ea9425995e7f9823e4f6034,https://s.alicdn.com/@sc04/kf/H4a2eb5b743e44122b5bc19f26d97890ev.jpg_300x300.jpg,$0.30-0.90,Advanced PVD Coated CNC Components Stainless Steel   for Extreme Environments with HVOF Spray Coating
https://www.alibaba.com/product-detail/For-Fujifilm-X-T100-XT100-XT30_1601617591160.html?priceId=378be75b4ea9425995e7f9823e4f6034,https://s.alicdn.com/@sc04/kf/H3b5467709f9b4eb8a9e040671c6b4323Q.jpg_300x300.jpg,$71,For Fujifilm X-T100 XT100 XT30 LCD  Screen Replacement
https://www.alibaba.com/product-detail/For-TECNO-Camon-19-Pro-Ci8_1601504102165.html?priceId=378be75b4ea9425995e7f9823e4f6034,https://s.alicdn.com/@sc04/kf/Hffaf196ce20944e3a2bade76b6174dd3z.jpeg_300x300.jpeg,$0.10-0.15,For TECNO Camon 19 Pro Ci8 Ci6 OEM Back  Lens Glass Replacement for Mobile Phones Rear  Repair Spare
https://www.alibaba.com/product-detail/Customized-OEM-Manufacturing-Mass-Production-CNC_1601488403992.html?priceId=378be75b4ea9425995e7f9823e4f6034,https://s.alicdn.com/@sc04/kf/H1b29554f73aa42bd9b1f884a19164df6y.jpg_300x300.jpg,$0.50-1,Customized OEM Manufacturing Mass Production CNC Milling Machined Aluminum Sliver Anodized  Accessories Enclosure
https://www.alibaba.com/product-detail/Front-Rear-Camera-Dual-Lens-360_1601677139960.html?priceId=378be75b4ea9425995e7f9823e4f6034,https://s.alicdn.com/@sc04/kf/H833a3aa7a41d4694bf19788a3566c8bfp.jpg_300x300.jpg,$42-45,Front Rear  Dual-Lens 360 Imaging Module With Integration for Insta360 One R/Rs  Accessories Repair
https://www.alibaba.com/product-detail/Direct-From-Factory-50mm-F1-8_1601617400641.html?priceId=378be75b4ea9425995e7f9823e4f6034,https://s.alicdn.com/@sc04/kf/H4e5852b88e4e497a9a4f38307699d253p.jpg_300x300.jpg,$59-69,Direct From Factory 50mm F1.8 AF/MF Large Aperture Lens for Nikon DSLR  EF Mount Sony  C Mount Lens
https://www.alibaba.com/product-detail/Hot-Sale-LINKSCAN-25MP-Fixed-Focus_1601473365689.html?priceId=378be75b4ea9425995e7f9823e4f6034,https://s.alicdn.com/@sc04/kf/Hfe9812df7cac4427bac6f7051e00b90dr.jpg_300x300.jpg,$118,"Hot Sale LINKSCAN 25MP Fixed Focus C-mount FA Machine Vision  Lens 1.1"" 16mm F2.8-F16 Full Frame High Performance <0.09%"
https://www.alibaba.com/product-detail/cnc-numerical-control-precision-machining-electronic_1601459007058.html?priceId=378be75b4ea9425995e7f9823e4f6034,https://s.alicdn.com/@sc04/kf/H87d737bd51b84f4a8e44cdf8b75ab958l.jpg_300x300.jpg,$0.35-1.58,cnc numerical control precision machining electronic digital accessories aluminum alloy processing  shell product
https://www.alibaba.com/product-detail/Custom-CNC-Auto-Spare-Parts-Digital_1601615763011.html?priceId=378be75b4ea9425995e7f9823e4f6034,https://s.alicdn.com/@sc04/kf/H71ae3045513d4c8eac8ca3e19e98f54bT.jpg_300x300.jpg,$0.36-1.15,Custom CNC Auto Spare  Digital  Lens  High Precision Aluminum Steel Brass CNC Turning Milling Machining
https://www.alibaba.com/product-detail/Good-Replacement-for-iPhone-15-Back_1601450973247.html?priceId=378be75b4ea9425995e7f9823e4f6034,https://s.alicdn.com/@sc04/kf/H4aa140fa8aaf468ea0f5753cee5d3b61c.jpg_300x300.jpg,$25.51-25.81,Good Replacement for iPhone 15 Back  Rear  Repair
https://www.alibaba.com/product-detail/for-RunCam-Helmet-Camera-UAV-Components_1601433346752.html?priceId=378be75b4ea9425995e7f9823e4f6034,https://s.alicdn.com/@sc04/kf/H6e7b9a119a4447508c4d96a5ba4e589eB.jpg_300x300.jpg,$46.95-59.99,"for RunCam Helmet  UAV Components 1/2.9"" Sensor 1920x1080 60fps Auto ISO Shutter MP4 Video Format FPV Drone Spare"
