product_url,image_url,price,title
https://www.alibaba.com/product-detail/HONGDAK-for-Insta360-X5-Replacement-Lens_1601616695281.html?priceId=74719c914b474a7dae9277cd0cd7e888,https://s.alicdn.com/@sc04/kf/H8a89f23ef5124c69a3cf362bf1f31a7dU.jpg_300x300.jpg,$16.89-26.99,HONGDAK for Insta360 X5 Replacement Lens Kit- DIY Repair Lens for Enhanced Photography Action  Accessories
https://www.alibaba.com/product-detail/Wholesale-Infrared-256-384-640-Thermal_1601582013391.html?priceId=74719c914b474a7dae9277cd0cd7e888,https://s.alicdn.com/@sc04/kf/He54c71fc03604c3d8e86f273ae54f0a3e.jpg_300x300.jpg,$216.50-219,Wholesale Infrared 256/384/640 Thermal Imaging Module Mini Thermal  Mainboard with 4mm/9mm Lens with CVBS/USB Output
https://www.alibaba.com/product-detail/Precision-Metal-Parts-Stainless-Steel-Aluminum_1601236099173.html?priceId=74719c914b474a7dae9277cd0cd7e888,https://s.alicdn.com/@sc04/kf/He7708df28ed9424e974f5d79011a7fa1t.jpg_300x300.jpg,$0.20-2,Precision Metal  Stainless Steel Aluminum Alloy CNC Machined Custom Auto Bicycle  Accessories OEM
https://www.alibaba.com/product-detail/The-A0009055505-YAOPEI-Rearview-Camera-Is_1601522098031.html?priceId=74719c914b474a7dae9277cd0cd7e888,https://s.alicdn.com/@sc04/kf/Hc8951b500da7472495fc0ef95e394189g.jpg_300x300.jpg,$70,The A0009055505 YAOPEI Rearview  Is Suitable for Car
https://www.alibaba.com/product-detail/DF-Wholesale-Original-Z50-Camera-Top_1600935672326.html?priceId=74719c914b474a7dae9277cd0cd7e888,https://s.alicdn.com/@sc04/kf/Hadfc47664965494592fb2c722985b422u.jpg_300x300.jpg,$55,DF Wholesale Original Z50  Top Cover Full Set Premium Action & Sports   Accessories Japan Made Private Mold
https://www.alibaba.com/product-detail/New-Rear-Camera-Lens-Cover-for_1600401371690.html?priceId=74719c914b474a7dae9277cd0cd7e888,https://s.alicdn.com/@sc04/kf/Hfac94aa4df2345d0997b861a3c3fec2fX.jpg_300x300.jpg,$1.39-1.99,New Rear  Lens Cover for iPhone 12 Pro Max  Lens Glass With Glue Sticker for iPhone 11 13pro Max Replacement
https://www.alibaba.com/product-detail/Org-Replacement-for-iPhone-14-Back_1601446030877.html?priceId=74719c914b474a7dae9277cd0cd7e888,https://s.alicdn.com/@sc04/kf/Hccec20f2f51843eabdd9975eee95c465K.png_300x300.png,$37.94-38.24,Org Replacement for iPhone 14 Back  Rear  Repair
https://www.alibaba.com/product-detail/Mobile-Phone-Rear-Camera-for-iPhone_11000005261812.html?priceId=74719c914b474a7dae9277cd0cd7e888,https://s.alicdn.com/@sc04/kf/H6b7a79254cf446ef8740f88aa976ba4bX.jpg_300x300.jpg,$2.10-9.38,Mobile Phone Rear  for iPhone 13 Pro Max 13 Mini 12 Pro 12 Mini 11 Pro MAX XR XS MAX SE 5-8P  Rear Flash
https://www.alibaba.com/product-detail/Original-Andepo-Rear-Camera-for-iPhone_1601634405825.html?priceId=74719c914b474a7dae9277cd0cd7e888,https://s.alicdn.com/@sc04/kf/H2576c67220f14b069862b1cfa92940a7D.jpg_300x300.jpg,$6.99,"Original Andepo Rear  for iPhone 8, High Quality Back  Lens & Assembly Replacement, Bulk Wholesale"
https://www.alibaba.com/product-detail/OEM-ODM-High-Precision-Standards-Custom_1601545377880.html?priceId=74719c914b474a7dae9277cd0cd7e888,https://s.alicdn.com/@sc04/kf/Hcad83bca85d54fe08d233fa807dc8509N.jpg_300x300.jpg,$1.12-2.30,OEM/ODM High Precision Standards Custom CNC Machining Anodised Aluminum Stainless Steel Copper Brass   Accessories
https://www.alibaba.com/product-detail/YUNTENG-Universal-1-4-Quick-Release_1601320118294.html?priceId=74719c914b474a7dae9277cd0cd7e888,https://s.alicdn.com/@sc04/kf/H5ff94e885b58471ab2386ba195a8afabf.jpg_300x300.jpg,$0.91,"YUNTENG Universal 1/4 Quick Release Plate Clamp  Mounting Adapter  Tripod Head Replacement Baseplate Attachment, 1PC"
https://www.alibaba.com/product-detail/New-1-3-CMOS-1500TVL-Mini_1601677825781.html?priceId=74719c914b474a7dae9277cd0cd7e888,https://s.alicdn.com/@sc04/kf/H3cc50751fc0a48c69cbb081a1de18ee3A.jpg_300x300.jpg,$3.50-6,New 1/3 CMOS 1500TVL Mini FPV Analog  2.8mm Lens PAL NTSC With OSD Internal Adjustable for Racing Drone
https://www.alibaba.com/product-detail/For-ITEL-P17-Replacement-Back-Camera_1601659707209.html?priceId=74719c914b474a7dae9277cd0cd7e888,https://s.alicdn.com/@sc04/kf/H50e6084c3abe44b29439b407a2e756491.png_300x300.png,$8-11,For ITEL P17 Replacement Back  Glass Lens for ITEL P17  Lens+frame
https://www.alibaba.com/product-detail/PULUZ-Max-Lens-Mod-Wide-Angle_1601422407396.html?priceId=74719c914b474a7dae9277cd0cd7e888,https://s.alicdn.com/@sc04/kf/H57cc7efc0e604839926cb4827fb42d4al.jpg_300x300.jpg,$17-21.50,PULUZ Max Lens Mod Wide Angle Lens  Accessory Action  Lens Attachment Expansion  for GoPro
https://www.alibaba.com/product-detail/In-Stock-Original-ONEX5-Insta-360_1601431601418.html?priceId=74719c914b474a7dae9277cd0cd7e888,https://s.alicdn.com/@sc04/kf/H4626a7e239974c27a016919d9e03ba33f.png_300x300.png,$45-64.50,In Stock Original ONEX5 Insta 360 One X5 IInsta360 X5 Utility Frame  Accessories Spare  Travel for Videos
https://www.alibaba.com/product-detail/Original-NEW-08981J-8981J-Webcam-Module_1600996836368.html?priceId=74719c914b474a7dae9277cd0cd7e888,https://s.alicdn.com/@sc04/kf/H85734db383ee4ec890861ec25d98d59e2.png_300x300.png,$6-10,Original NEW 08981J 8981J Webcam Module  for DELL Precision 3570 3540 Latitude 5520 5500 5510 Electronics Repair
https://www.alibaba.com/product-detail/HOVERAir-X1-Self-Flying-Camera-Accessories_1600996435221.html?priceId=74719c914b474a7dae9277cd0cd7e888,https://s.alicdn.com/@sc04/kf/He7dce40740ea449a8f6a227c1c20d50cK.png_300x300.png,$36-38,HOVERAir X1 Self-Flying  Accessories: Hover  Battery Charging Hub & Batteries Replacement
https://www.alibaba.com/product-detail/CNC-Machining-Metal-Part-Outdoor-Security_1600455714017.html?priceId=74719c914b474a7dae9277cd0cd7e888,https://s.alicdn.com/@sc04/kf/He8a7838315374daab27c97b7c1ecfe51D.jpg_300x300.jpg,$1-8,CNC Machining Metal  Outdoor Security  Housing case Waterproof Box Aluminum  OEM Customized Service
https://www.alibaba.com/product-detail/Infrared-256-384-640-Thermal-Imaging_1601606385485.html?priceId=74719c914b474a7dae9277cd0cd7e888,https://s.alicdn.com/@sc04/kf/Haaccb6eb0e2b49c9b59ab37dbd4b275dC.jpg_300x300.jpg,$216.50-219,Infrared 256/384/640 Thermal Imaging Module Mini Thermal  UVC  Mainboard with 4mm/9mm Lens with CVBS/USB Output
https://www.alibaba.com/product-detail/A380-Aluminum-Pressure-Die-Casting-Part_1601227623692.html?priceId=74719c914b474a7dae9277cd0cd7e888,https://s.alicdn.com/@sc04/kf/Hf474c1fd4b324cee8f200b9a455eea10X.jpg_300x300.jpg,"$2,000-3,000",A380 Aluminum Pressure Die Casting  for  Housing
https://www.alibaba.com/product-detail/Clear-Plastic-Molding-Transparent-Hdpe-Precision_1601633772654.html?priceId=74719c914b474a7dae9277cd0cd7e888,https://s.alicdn.com/@sc04/kf/H24b262bb66934b62bc64f1f19d13d99bu.jpg_300x300.jpg,$0.10-0.99,Clear Plastic Molding Transparent Hdpe Precision  CNC Machining  Transp Service Nice Cnc Aluminum Vesa Stand Red Pegs
https://www.alibaba.com/product-detail/CNC-Machining-Machined-Aluminum-Parts-Service_1601679243069.html?priceId=74719c914b474a7dae9277cd0cd7e888,https://s.alicdn.com/@sc04/kf/H175c279b44004645b2235006e28a3106v.png_300x300.png,$1-2,CNC Machining Machined Aluminum  Service with Aluminum CNC Machining and Milling for  Components and Accessories
https://www.alibaba.com/product-detail/Precision-Aluminum-Cnc-Milling-Camera-Parts_1601574856814.html?priceId=74719c914b474a7dae9277cd0cd7e888,https://s.alicdn.com/@sc04/kf/Hbfea41563b2e4c5da68ad80dfc5ec37aQ.jpg_300x300.jpg,$0.05-0.20,Precision Aluminum Cnc Milling   Machining Brass Mechanical Spare  Manufacturers
https://www.alibaba.com/product-detail/DF-Wholesale-Original-Genuine-D3200-Camera_1600933373004.html?priceId=74719c914b474a7dae9277cd0cd7e888,https://s.alicdn.com/@sc04/kf/H62073b7fd4d04308bd503565f8538aeds.jpg_300x300.jpg,$40,DF Wholesale Original Genuine D3200  Body Top Cover Premium  Accessories
https://www.alibaba.com/product-detail/2016-2022-Chevrolet-Malibu-Rearview-Camera_1601522862514.html?priceId=74719c914b474a7dae9277cd0cd7e888,https://s.alicdn.com/@sc04/kf/H52083652749a46898d191fe3ece3ee4aO.jpg_300x300.jpg,$31,2016-2022 Chevrolet Malibu Rearview   Support Module 23334180
https://www.alibaba.com/product-detail/RQ-MINI256-9-JS-MINI384-9_1601697248826.html?priceId=74719c914b474a7dae9277cd0cd7e888,https://s.alicdn.com/@sc04/kf/H763cc3fa5bb248a7912ed649ebc401a72.jpg_300x300.jpg,$145.20-459.30,RQ-MINI256-9 JS-MINI384-9 JS-MINI640-9 Thermal Imaging  4.0mm 6.8mm 9.7mm Lens Drone Fpv  Kit
https://www.alibaba.com/product-detail/Original-Andepo-Rear-Camera-for-iPhone_1601647398489.html?priceId=74719c914b474a7dae9277cd0cd7e888,https://s.alicdn.com/@sc04/kf/H35a3d5341c594929a2ed45d103139f03Q.jpg_300x300.jpg,$12.30,"Original Andepo Rear  for iPhone 7 plus, High Quality Back  Lens & Assembly Replacement, Bulk Wholesale"
https://www.alibaba.com/product-detail/New-For-Infinix-Zero-8-Rear_1601265956602.html?priceId=74719c914b474a7dae9277cd0cd7e888,https://s.alicdn.com/@sc04/kf/H17a6240eb70c4fdd8c29a7c343d48d013.jpg_300x300.jpg,$0.10-1,New For Infinix Zero 8 Rear Back  Glass Lens Replacement  Cover with Adhesive Sticker X687
https://www.alibaba.com/product-detail/Best-Selling-Wholesale-Phone-Spare-Parts_1601242262048.html?priceId=4edf7c610ad14f1a8113a0c55129a9f0,https://s.alicdn.com/@sc04/kf/H1dc91f10a9654c7397e54444da21269b2.jpg_300x300.jpg,$16.84,Best Selling Wholesale Phone Spare  for Xiaomi 14 Pro Original Main Back Facing
https://www.alibaba.com/product-detail/Massa-CNC-Machining-NEX-Camera-Lens_1394775283.html?priceId=4edf7c610ad14f1a8113a0c55129a9f0,https://s.alicdn.com/@sc04/kf/H4c2335aa55ec4f4baad22b5d801388b6V.png_300x300.png,$5,Massa CNC Machining NEX  Lens Adapter Ring Digital  Accessories for Canon for Nikon for Sony Photographic Equipment
https://www.alibaba.com/product-detail/High-Precision-CNC-Machined-Anodized-Aluminum_1601566251493.html?priceId=4edf7c610ad14f1a8113a0c55129a9f0,https://s.alicdn.com/@sc04/kf/Hb3353d36034a4f26b6f494a9130ad308s.jpg_300x300.jpg,$5-10,High Precision CNC Machined Anodized Aluminum Anti-Scratch Portable  Cage Accessories  Handle Poyinco OEM
https://www.alibaba.com/product-detail/Air-3-Gimbal-Camera-Flex-Ribbon_1601680253717.html?priceId=4edf7c610ad14f1a8113a0c55129a9f0,https://s.alicdn.com/@sc04/kf/H05f2bfa54d2e49d8b08d05164e2014b9H.png_300x300.png,$2.60-3,Air 3 Gimbal  Flex Ribbon Cable Spare  PTZ  Flat Cable for DJI Mavic Air 3 Replacement
https://www.alibaba.com/product-detail/Original-Gimbal-with-Camera-for-Mavic_1601589509478.html?priceId=4edf7c610ad14f1a8113a0c55129a9f0,https://s.alicdn.com/@sc04/kf/H5f7f29986e6c426783702ab1bcb46eedw.jpg_300x300.jpg,$0.80-1,Original Gimbal with  for Mavic 4 Pro Full Gimbal Replacement for Mavic 4 Pro Repair Spare
https://www.alibaba.com/product-detail/OEM-COMS-5MP-Fisheye-Wide-angle_1600459618466.html?priceId=4edf7c610ad14f1a8113a0c55129a9f0,https://s.alicdn.com/@sc04/kf/Hd8fc535e44e9460c9df3309e72fc7bcbS.jpg_300x300.jpg,$7.90-10.80,OEM COMS 5MP Fisheye Wide-angle Lens 170 Degree OV5640 24pin the COMS DVP Interface 1080P  Module
https://www.alibaba.com/product-detail/640x512-Thermal-Imaging-Camera-Module-Thermal_1601469353226.html?priceId=4edf7c610ad14f1a8113a0c55129a9f0,https://s.alicdn.com/@sc04/kf/Hecd9386a5c0840cd9a83399c02b6bacbt.jpg_300x300.jpg,$495-520,640x512 Thermal Imaging  Module Thermal Sensor  Mainboard with CVBS/UVC/RJ45 Output and 9mm Lens
https://www.alibaba.com/product-detail/For-Samsung-Galaxy-A31-A32-Camera_1601615159562.html?priceId=4edf7c610ad14f1a8113a0c55129a9f0,https://s.alicdn.com/@sc04/kf/Hde3a639221a7461c9434e8389be2720fQ.jpg_300x300.jpg,$1.99-4.99,For Samsung Galaxy A31 A32   Replacement Front  Module Replacement Front Facing  Replace Model: A315 A325
https://www.alibaba.com/product-detail/Universal-Aluminum-Alloy-Quick-Release-Mounting_1600504981960.html?priceId=4edf7c610ad14f1a8113a0c55129a9f0,https://s.alicdn.com/@sc04/kf/H4f8f6fb23603461da3774d703b1d5e2e8.jpg_300x300.jpg,$2.45-2.50,Universal Aluminum Alloy Quick Release Mounting L Plate for Canon Sony Pentax Fujifilm DSLR  Photo Studio Accessory
https://www.alibaba.com/product-detail/Custom-CNC-Machined-Camera-Accessories-with_1601689765706.html?priceId=4edf7c610ad14f1a8113a0c55129a9f0,https://s.alicdn.com/@sc04/kf/H384ea6c56ffc4382aeaa4a72d2aaa322i.jpg_300x300.jpg,$0.10-0.50,Custom CNC Machined  Accessories with Precision Metal  Fabrication 6061 Aluminum One-Stop Processing
https://www.alibaba.com/product-detail/DongFu-Wholesale-Original-Digital-Camera-Spare_1600935461934.html?priceId=4edf7c610ad14f1a8113a0c55129a9f0,https://s.alicdn.com/@sc04/kf/H24476d5a66314e0ab989ff50ba1b8a82a.jpg_300x300.jpg,$100,DongFu Wholesale Original Digital  Spare  Mainboard for Nikon D800  Accessories
https://www.alibaba.com/product-detail/JSD2528-F2-8-Fixed-Focus-Camera_1601155458536.html?priceId=4edf7c610ad14f1a8113a0c55129a9f0,https://s.alicdn.com/@sc04/kf/H2d4775c5bc154bbe9dfa0d9ec01988d37.jpg_300x300.jpg,$4-5,"JSD2528 F2.8 Fixed Focus  Lens with TTL22.8mm Large Degree Hov126 for 2/5\"" Sensor Cameras Accessory"
https://www.alibaba.com/product-detail/Professional-OEM-Supplier-of-Industrial-Equipment_1601557548407.html?priceId=4edf7c610ad14f1a8113a0c55129a9f0,https://s.alicdn.com/@sc04/kf/Hd4f81f38d3f7462ca2e6bc4bdcd1e403u.jpg_300x300.jpg,$0.30-0.90,Professional OEM Supplier of Industrial Equipment DSLR  Cage-Customized CNC Machining Broaching Stainless Steel
https://www.alibaba.com/product-detail/High-Performance-CNC-Machining-Service-Pure_1601588252778.html?priceId=4edf7c610ad14f1a8113a0c55129a9f0,https://s.alicdn.com/@sc04/kf/Hf7a13927b95d4dddb6024a3f08269ee8d.png_300x300.png,$0.29-1.28,"High Performance CNC Machining Service Pure Mechanical Fixation DSLR   Customization, DSLR  Filter Adapter"
https://www.alibaba.com/product-detail/Factory-Direct-Camera-Screw-Quick-Release_1601018820967.html?priceId=4edf7c610ad14f1a8113a0c55129a9f0,https://s.alicdn.com/@sc04/kf/H194127c5b50e4f4ba6d22b37fa617b21e.png_300x300.png,$0.15-0.80,Factory Direct  Screw Quick Release Plate Screw 1/4 Turn 3/8 Conversion Screw Small Turn Big Pan/tilt Base Nut Hot Shoe
https://www.alibaba.com/product-detail/HS-HS-012-18mm-Hole-Spacing_1601290874970.html?priceId=4edf7c610ad14f1a8113a0c55129a9f0,https://s.alicdn.com/@sc04/kf/He9759340788b4220b67159b5501d8b4fA.jpg_300x300.jpg,$1.80-2.50,HS HS-012 18mm Hole Spacing 7 8 10 14 16.5mm High Extended PVC/LCP Bottom Frame  Accessories M12 Lens Holder Black/Grizzly
https://www.alibaba.com/product-detail/Customized-CNC-3D-Metal-Camera-Kit_1601447774935.html?priceId=4edf7c610ad14f1a8113a0c55129a9f0,https://s.alicdn.com/@sc04/kf/H1ae18a3c697b48e295732f29ba50e156W.png_300x300.png,$5-35,Customized CNC 3D Metal  Kit Assembly Model Factory Supply
https://www.alibaba.com/product-detail/Wholesale-Repair-Spare-Parts-Rear-Cam_62231983705.html?priceId=4edf7c610ad14f1a8113a0c55129a9f0,https://s.alicdn.com/@sc04/kf/Hfd35a28e9e69459e843961f4ffb6a7d7M.jpg_300x300.jpg,$12-23,Wholesale Repair Spare  Rear Cam Back  for OnePlus 6
https://www.alibaba.com/product-detail/Custom-Made-Zinc-Aluminium-Die-Casting_1600722741859.html?priceId=4edf7c610ad14f1a8113a0c55129a9f0,https://s.alicdn.com/@sc04/kf/Hfb32750c520844c6b4bf27109832b5142.jpg_300x300.jpg,$0.10-9.90,Custom Made Zinc & Aluminium Die Casting  CCTV  for Case
https://www.alibaba.com/product-detail/Camera-Accessories-Full-Rubber-Quick-Release_1601426447402.html?priceId=4edf7c610ad14f1a8113a0c55129a9f0,https://s.alicdn.com/@sc04/kf/Ha51f6568da8d43dba6fa9f46531db151Q.jpg_300x300.jpg,$2.10-2.50,Accessories Full Rubber Quick-Release Plate with Anti-Skid Spare  for Photography Tripod
https://www.alibaba.com/product-detail/Fuji-NXT-Third-Generation-Component-Camera_1601461237345.html?priceId=4edf7c610ad14f1a8113a0c55129a9f0,https://s.alicdn.com/@sc04/kf/H6e3335ef826845ef87b8609abc7b2de7n.jpg_300x300.jpg,"$6,399",Fuji NXT Third Generation Component  2UGGG000100 P05CL   Original New
https://www.alibaba.com/product-detail/Custom-CNC-Machined-Aluminum-Camera-Mount_1601281454152.html?priceId=4edf7c610ad14f1a8113a0c55129a9f0,https://s.alicdn.com/@sc04/kf/H375fa8f32452409aa8ccb88f9651ff63V.jpg_300x300.jpg,$4.10-8,Custom CNC Machined Aluminum  Mount Optical  Black Anodizing for Microscope  Projector Instrument
https://www.alibaba.com/product-detail/Hot-Sale-Brand-New-Agras-T40_1601688166910.html?priceId=4edf7c610ad14f1a8113a0c55129a9f0,https://s.alicdn.com/@sc04/kf/Hcada6b88d60d4654926b2ede71d05331F.jpg_300x300.jpg,$11.46,Hot Sale Brand New Agras T40/T20P FPV  Module Bracket Agricultural Drone Repair
https://www.alibaba.com/product-detail/CNC-Manufacturer-Factory-Customization-Camera-Accessories_1601666527371.html?priceId=4edf7c610ad14f1a8113a0c55129a9f0,https://s.alicdn.com/@sc04/kf/H3e227db665d44842b24663c33dfad459V.png_300x300.png,$0.75-0.87,CNC Manufacturer Factory Customization  Accessories CNC Machining Aluminum Stainless Steel CNC Machining
https://www.alibaba.com/product-detail/Produce-Custom-Lenses-Along-with-Matching_1601668355954.html?priceId=4edf7c610ad14f1a8113a0c55129a9f0,https://s.alicdn.com/@sc04/kf/H25070fda41c54d788f724b23b5a22853L.jpg_300x300.jpg,"$6,800-6,850",Produce Custom Lenses Along with Matching  Bodies for  Sensors.
https://www.alibaba.com/product-detail/Stainless-Steel-20mm-Camera-Head-Pipe_1601586111674.html?priceId=4edf7c610ad14f1a8113a0c55129a9f0,https://s.alicdn.com/@sc04/kf/Hc761bec6ce3845b3b91680d7437de1a9b.jpg_300x300.jpg,$150,Stainless Steel 20mm  Head Pipe  Spare  HD Sewer  Head IP68 Waterproof
https://www.alibaba.com/product-detail/Cnc-Machining-Electronic-Accessory-Hardware-Aluminum_1600832164613.html?priceId=4edf7c610ad14f1a8113a0c55129a9f0,https://s.alicdn.com/@sc04/kf/H50724c757000401fa264ef7b94013500f.jpg_300x300.jpg,$2-3,Cnc Machining Electronic Accessory Hardware Aluminum Shell for  Die-Casting Services Product
https://www.alibaba.com/product-detail/Customized-OEM-Manufacturing-Mass-Production-CNC_1601548099864.html?priceId=4edf7c610ad14f1a8113a0c55129a9f0,https://s.alicdn.com/@sc04/kf/Ha393ebcca1dd46be877572b87a29d5d8P.jpg_300x300.jpg,$0.98-2.68,Customized OEM Manufacturing Mass Production CNC Milling Machined Aluminum Sliver Anodized  Accessories Enclosure
https://www.alibaba.com/product-detail/Custom-Beauty-Instrument-Shell-Die-Casting_1601446837693.html?priceId=4edf7c610ad14f1a8113a0c55129a9f0,https://s.alicdn.com/@sc04/kf/H927723aea70d47b7838e18aa36bba1acY.jpg_300x300.jpg,$3.50-8,Custom Beauty Instrument Shell Die-Casting Services Digital  Lens Housing  Casting
https://www.alibaba.com/product-detail/Bestselling-Automobile-Spare-Parts-Car-Rear_1601600215535.html?priceId=4edf7c610ad14f1a8113a0c55129a9f0,https://s.alicdn.com/@sc04/kf/H49f5291c24784098af9966e8565ad984U.jpg_300x300.jpg,$23.89-24.50,Bestselling Automobile Spare  Car Rear  99240-L6500 99240L6500
https://www.alibaba.com/product-detail/Manufacturer-Offers-Precision-CNC-Broaching-Aluminum_1601529639663.html?priceId=4edf7c610ad14f1a8113a0c55129a9f0,https://s.alicdn.com/@sc04/kf/H06065491e56d41b287fdc03344c84e2b6.png_300x300.png,$0.99,Manufacturer Offers Precision CNC Broaching Aluminum Alloy  Non-Standard Hardware Accessories for  Lens
https://www.alibaba.com/product-detail/OEM-ODM-Custom-Oxidation-Aluminium-Mounting_1600532172860.html?priceId=4edf7c610ad14f1a8113a0c55129a9f0,https://s.alicdn.com/@sc04/kf/Haed2ffed97fa4411b6ed89450ef4a080n.jpg_300x300.jpg,$0.16-0.38,OEM ODM Custom Oxidation Aluminium Mounting Screw Type Quick Release Plate for  Tripod
https://www.alibaba.com/product-detail/New-CADDXFPV-006HD-Thermal-Imaging-Camera_1601610557528.html?priceId=4edf7c610ad14f1a8113a0c55129a9f0,https://s.alicdn.com/@sc04/kf/H0e332a13deba4d05a614230dfc98be0dI.jpg_300x300.jpg,$759-788,New CADDXFPV 006HD Thermal Imaging  640HD 384 256 for RC FPV Racing Freestyle Drones DIY
https://www.alibaba.com/product-detail/Wholesale-Bronze-Gun-Plastic-Customized-Aluminum_1601369772489.html?priceId=4edf7c610ad14f1a8113a0c55129a9f0,https://s.alicdn.com/@sc04/kf/H7ac191a92e8b41edb52e43dc30a10139Z.jpg_300x300.jpg,$1-3.90,Wholesale Bronze Gun Plastic Customized Aluminum  Cnc Machining
https://www.alibaba.com/product-detail/New-for-Dual-12MP-Rear-Camera_1601696144663.html?priceId=4edf7c610ad14f1a8113a0c55129a9f0,https://s.alicdn.com/@sc04/kf/Hdc59633d02ca4430bd1144d8da42c765f.jpg_300x300.jpg,$20.62,New for Dual 12MP Rear  Module (Small Board) for iPhone X Replacement
https://www.alibaba.com/product-detail/Customized-CNC-Machining-of-Parts-Precise_1600230456848.html?priceId=4edf7c610ad14f1a8113a0c55129a9f0,https://s.alicdn.com/@sc04/kf/H7a049b7a4c444bb8b509b20d195039f0x.jpg_300x300.jpg,$13.90-28.50,Customized CNC Machining of  Precise Micro Turned Aluminum and Stainless Steel Hengruifeng Accepts CCTV  Housing
https://www.alibaba.com/product-detail/Quality-Assurance-Custom-CNC-Parts-Milling_1601372161581.html?priceId=4edf7c610ad14f1a8113a0c55129a9f0,https://s.alicdn.com/@sc04/kf/H39031caacd9943779cd3b4c74bc12a37F.jpg_300x300.jpg,$0.46-1.55,Quality Assurance Custom CNC  Milling and Turning Machining Service CNC Milling  for
https://www.alibaba.com/product-detail/Spare-Parts-LCD-Screen-Display-for_11000005671281.html?priceId=4edf7c610ad14f1a8113a0c55129a9f0,https://s.alicdn.com/@sc04/kf/A7994b627c4a34339a7e77b38f3102adap.png_300x300.png,$2.30-21.50,Spare  LCD Screen Display for Huawei Back Front  Lens Charger Connector Port Flex Sensor Mainboard Speaker Buzzer
https://www.alibaba.com/product-detail/2025-Original-Insta360-X5-Utility-Frame_1601433344615.html?priceId=4edf7c610ad14f1a8113a0c55129a9f0,https://s.alicdn.com/@sc04/kf/H861fb5cb15be4f799cd6dbe5bc9b560ey.jpg_300x300.jpg,$44.75-53.75,2025 Original Insta360 X5 Utility Frame for Insta 360 X5  Accessories Spare  Travel for Videos
https://www.alibaba.com/product-detail/Custom-Steel-Iron-SUS430L-Sintered-Metal_1600992741701.html?priceId=4edf7c610ad14f1a8113a0c55129a9f0,https://s.alicdn.com/@sc04/kf/H94d4fa7c5f394a87a431d47c35eb57caF.jpg_300x300.jpg,$0.19-0.99,Custom Steel Iron SUS430L Sintered Metal MIM Wall Mount Adapter for NetCam  Plate
https://www.alibaba.com/product-detail/L-Shape-Universal-Camera-Bracket-Quick_1601121331851.html?priceId=4edf7c610ad14f1a8113a0c55129a9f0,https://s.alicdn.com/@sc04/kf/Hf68c9f195b8f49edadc6f784ae189278r.jpg_300x300.jpg,$2.35-3.50,L-Shape Universal  Bracket Quick Release L Plate 1/4 Inch Screw Swiss Vertical Video Compatible for Nikon Canon Sony Fuji
https://www.alibaba.com/product-detail/Stainless-Steel-Drone-Battery-Housing-Camera_1601558362139.html?priceId=4edf7c610ad14f1a8113a0c55129a9f0,https://s.alicdn.com/@sc04/kf/Hf44af6550e1a42d899ddf74a2da11886b.jpg_300x300.jpg,$0.92-0.95,Stainless Steel Drone Battery Housing  Gimbal  CNC Machining by CNC Machine Shop Including Wire EDM Broaching Types
https://www.alibaba.com/product-detail/IATF16949-OEM-Aluminum-Alloy-Camera-Lens_1601521575378.html?priceId=4edf7c610ad14f1a8113a0c55129a9f0,https://s.alicdn.com/@sc04/kf/H5fbb5a21e4b74f9cb7a38bf3466d61b96.png_300x300.png,$4.50-5,IATF16949 OEM Aluminum Alloy  Lens Accessories Die Casting Services
https://www.alibaba.com/product-detail/Original-Genuine-CCD-Camera-J6751014A-Vision_1601646561845.html?priceId=4edf7c610ad14f1a8113a0c55129a9f0,https://s.alicdn.com/@sc04/kf/H5471877f75bd4f42b249be6ce16d973fN.jpg_300x300.jpg,$349,Original Genuine CCD  J6751014A Vision Module SMT Spare  Core Component SMT Assembly Pick Place Machine
https://www.alibaba.com/product-detail/Yuer-Tripod-Quick-Release-Plate-Camera_1601581922624.html?priceId=4edf7c610ad14f1a8113a0c55129a9f0,https://s.alicdn.com/@sc04/kf/H58a1ebabe9a9451b9dc66595178243436.jpg_300x300.jpg,$2,Yuer Tripod Quick Release Plate  Mounting Adapter  Replacement
https://www.alibaba.com/product-detail/For-Tecno-Pouvoir-3-Air-LC6_1601659608841.html?priceId=4edf7c610ad14f1a8113a0c55129a9f0,https://s.alicdn.com/@sc04/kf/H1aefd4cc18f2459688ed62635be64c27u.png_300x300.png,$8-11,For Tecno Pouvoir 3 Air LC6 Replacement Back  Glass Lens for Tecno Pouvoir 3 Air LC6  Lens+frame
https://www.alibaba.com/product-detail/Aluminum-Die-Casting-Camera-Single-Lens_60359922527.html?priceId=4edf7c610ad14f1a8113a0c55129a9f0,https://s.alicdn.com/@sc04/kf/HTB1ju2tKXXXXXbNXVXXq6xXFXXXK.jpg_300x300.jpg,$1-5,Aluminum Die Casting  Single Lens Assembling  with Precision CNC Machining and +/-0.01mm Tolerance
https://www.alibaba.com/product-detail/Original-New-Camara-FUJI-AA66W-NXT_1600122607393.html?priceId=4edf7c610ad14f1a8113a0c55129a9f0,https://s.alicdn.com/@sc04/kf/Hf5c7ddc49a644ff3a0b3035bfc376cadh.jpg_300x300.jpg,"$1,200-1,400",Original New Camara FUJI AA66W NXT V12Head  Assy IPS With SMT Pick and Place Machine
https://www.alibaba.com/product-detail/Original-Gimbal-Part-for-DJI-Mini_1601313293212.html?priceId=4edf7c610ad14f1a8113a0c55129a9f0,https://s.alicdn.com/@sc04/kf/Hbf648da7fe9344e9b560be3f6539328dm.jpg_300x300.jpg,$1.49-1.52,Original Gimbal  for DJI Mini 3 Pro Drones Accessories Gimbal Housing Shell  Lens PTZ Signal Cable Yaw Roll Motor
https://www.alibaba.com/product-detail/Customized-Special-Size-Container-Security-Camera_1601111491630.html?priceId=4edf7c610ad14f1a8113a0c55129a9f0,https://s.alicdn.com/@sc04/kf/Haf2cd4931811443cab0a813202608b4dg.png_300x300.png,$2-5,Customized Special Size Container Security  Cam Accessories for Container
https://www.alibaba.com/product-detail/Professional-Precision-CNC-Machining-Parts-Custom_1601609900404.html?priceId=4edf7c610ad14f1a8113a0c55129a9f0,https://s.alicdn.com/@sc04/kf/Hea8af00925804e2caad8d762ff6523f4R.png_300x300.png,$1.80-2.10,Professional Precision CNC Machining  Custom Aluminum  Mounts Wire Stainless Steel Professional Precision
https://www.alibaba.com/product-detail/Wholesale-DSLR-SLR-Accessories-Kit-1_1601241866763.html?priceId=4edf7c610ad14f1a8113a0c55129a9f0,https://s.alicdn.com/@sc04/kf/Hcceca9b190be45169a1c18c10e8841002.png_300x300.png,$0.12-0.22,Wholesale DSLR SLR Accessories Kit 1/4 to 3/8 Male to Female Adapter Screw with Galvanized Finish for  and Tripod
