product_url,image_url,price,title
https://www.alibaba.com/product-detail/Wholesale-Price-Camera-Focus-Ring-Lens_62529799212.html?priceId=6a24f189ecc64444b2bb451200cf0a9b,https://s.alicdn.com/@sc04/kf/Hfda6860c345c44f382130c2426b0546eV.png_300x300.png,$0.35-0.70,Wholesale Price  Focus Ring Lens Adapter Aluminum Alloy Grip Camcorder Adjustable Rubber Follow Focus Gear Rings Belt
https://www.alibaba.com/product-detail/Selfie-Camera-Face-ID-Module-for_1601595272331.html?priceId=6a24f189ecc64444b2bb451200cf0a9b,https://s.alicdn.com/@sc04/kf/H07583910ca174bce956ac97106a73e0do.jpg_300x300.jpg,$3.99,Selfie  Face ID Module for iPhone 7 7p 8 8p-Electronics Repair
https://www.alibaba.com/product-detail/Wholesale-Camera-Accessories-Tripod-Spare-Part_60629578711.html?priceId=6a24f189ecc64444b2bb451200cf0a9b,https://s.alicdn.com/@sc04/kf/H5a84897bc74b4bd2821aaae312c3162aO.jpg_300x300.jpg,$5.78-6.25,Wholesale  Accessories Tripod Spare  360 Degree Panoramic Gimbal Tripod Head Quick Release Plate Clamp for Dslr
https://www.alibaba.com/product-detail/High-Performance-3-3G-VTX-Micro_1601594074673.html?priceId=6a24f189ecc64444b2bb451200cf0a9b,https://s.alicdn.com/@sc04/kf/H5a59e54fd91b4835804f4971f34bf9c1Q.jpg_300x300.jpg,$49.50,High-Performance 3.3G VTX Micro FPV  Drone RC  FP100 0.000001Lux 2.1mm Lens 16-9/4-3 NTSC/PAL Accessory Metal
https://www.alibaba.com/product-detail/Factory-Custom-Turning-Part-Anodizing-Camera_1600622117445.html?priceId=6a24f189ecc64444b2bb451200cf0a9b,https://s.alicdn.com/@sc04/kf/H3adf4b8bcf7a443796596115cea1e9d2D.jpg_300x300.jpg,$1.40-2,Factory Custom Turning  Anodizing  Enclosure Panel CNC Machining Steel Titanium Aluminum
https://www.alibaba.com/product-detail/Auto-Parts-Supplies-360-Camera-Dvd_1601609803337.html?priceId=6a24f189ecc64444b2bb451200cf0a9b,https://s.alicdn.com/@sc04/kf/Hd6081a0a35c64ce4b358636886627299m.jpg_300x300.jpg,$15.51-87.22,Auto  Supplies 360  Dvd Accessories Universal
https://www.alibaba.com/product-detail/For-EX-S770-S770-S880-Digital_1601521922281.html?priceId=6a24f189ecc64444b2bb451200cf0a9b,https://s.alicdn.com/@sc04/kf/Hbf46d847cf9046558c2220d3ec510731Y.jpg_300x300.jpg,$40,For EX-S770 S770 S880 Digital  Service  Backlit LCD Display
https://www.alibaba.com/product-detail/For-DJI-Mavic-Mini-Gimbal-Camera_1600479330300.html?priceId=6a24f189ecc64444b2bb451200cf0a9b,https://s.alicdn.com/@sc04/kf/H22e4607e860c4e0daa8256a8e25a572cb.jpg_300x300.jpg,$171.26-223.38,For DJI Mavic Mini Gimbal  Assembly Repair  Spare Replacement Drone Accessories
https://www.alibaba.com/product-detail/P100-Pro-Front-View-PSL-Camera_1601648213118.html?priceId=6a24f189ecc64444b2bb451200cf0a9b,https://s.alicdn.com/@sc04/kf/He998aa0cc903479a95a0b4ef4d9bcc2fr.png_300x300.png,$84-88,P100 Pro Front View - PSL  Agricultural Spraying Drone Accessories Original Drone
https://www.alibaba.com/product-detail/Factory-Aluminum-Custom-Metal-Processing-Service_1601622027190.html?priceId=6a24f189ecc64444b2bb451200cf0a9b,https://s.alicdn.com/@sc04/kf/H3b38a0d1d0ac4975b238c2243b17142ah.jpg_300x300.jpg,$3-8.50,Factory Aluminum Custom Metal Processing Service  Accessories 5 Axis Precision Aluminum Cnc Milling Machining
https://www.alibaba.com/product-detail/3504-Similar-Platform-12-Collector-Rings_1601684002561.html?priceId=6a24f189ecc64444b2bb451200cf0a9b,https://s.alicdn.com/@sc04/kf/H84e40185bb4c47cd93b0e3834a41b1daQ.jpg_300x300.jpg,$10-20,3504 Similar Platform 12 Collector Rings  Tripod  Pan Tilt GoPros 4 Dc Gimbal Motor
https://www.alibaba.com/product-detail/Phone-Repair-Wide-Camera-Part-for_1601597016961.html?priceId=6a24f189ecc64444b2bb451200cf0a9b,https://s.alicdn.com/@sc04/kf/H08705420b2f0478bba3954da438e04172.jpg_300x300.jpg,$4.65,Phone Repair Wide   for Samsung Galaxy S24 FE SM-S721B Original Wide  Replacement
https://www.alibaba.com/product-detail/CNC-Precision-Machined-Black-Aluminium-Camera_1601603143674.html?priceId=6a24f189ecc64444b2bb451200cf0a9b,https://s.alicdn.com/@sc04/kf/H1ce8066b23714bdda9e145fd212ae441O.jpg_300x300.jpg,$0.10,CNC/ Precision-Machined Black Aluminium  Lens Adapter Ring for Optics and Photography Equipment
https://www.alibaba.com/product-detail/Aluminum-Custom-1-4-to-3_1601282072871.html?priceId=6a24f189ecc64444b2bb451200cf0a9b,https://s.alicdn.com/@sc04/kf/H8a1eafb918de4f1ea2aa534d9ea3b6a07.jpg_300x300.jpg,$0.10-0.52,"Aluminum Custom 1/4"" to 3/8"" Flash  Head Base Adapter"
https://www.alibaba.com/product-detail/Custom-CNC-Machined-Copper-and-Brass_1601689820469.html?priceId=6a24f189ecc64444b2bb451200cf0a9b,https://s.alicdn.com/@sc04/kf/H28520294ad504c97ae25bbfd07f9db205.jpg_300x300.jpg,$0.10-0.50,Custom CNC Machined Copper and Brass  for  Accessories and Precision Repair Components Metal Fabricating
https://www.alibaba.com/product-detail/DECXIN-OG0328-0-3MP-120-degree_1601226504313.html?priceId=6a24f189ecc64444b2bb451200cf0a9b,https://s.alicdn.com/@sc04/kf/Ha9723250f5434a07bfe358d2da2ea742H.jpg_300x300.jpg,$2-3,DECXIN OG0328 0.3MP 120-degree Distortion-free HD  Module 24pin K210/STM32 Development Board DVP Interface 21MM
https://www.alibaba.com/product-detail/Stainless-Waterproof-Camera-Head-HD-1000_60124515667.html?priceId=6a24f189ecc64444b2bb451200cf0a9b,https://s.alicdn.com/@sc04/kf/Hf4244757c1504af7b3c5ae68e7ca226fi.jpg_300x300.jpg,$77-100,Stainless Waterproof  Head HD 1000 TVL CR006G Pipe  Spare  23mm Diameter  Head for Pipe Sewer
https://www.alibaba.com/product-detail/Original-Disassembled-Camera-Back-Lens-for_1601568784909.html?priceId=6a24f189ecc64444b2bb451200cf0a9b,https://s.alicdn.com/@sc04/kf/Hae7f425a2cc3477397fc708e16447ddd9.jpg_300x300.jpg,$39,Original Disassembled  Back Lens for Insta360 ONE X2
https://www.alibaba.com/product-detail/Factory-OEM-Customized-Action-Dslr-Camera_1601270241262.html?priceId=6a24f189ecc64444b2bb451200cf0a9b,https://s.alicdn.com/@sc04/kf/H5e63dda30f9b4b6c84a85921888b932eC.png_300x300.png,$1-5,Factory OEM Customized Action Dslr  Cage Case Without Handle  Frame Accessories
https://www.alibaba.com/product-detail/Camera-Module-Accessories-M12-Camera-Lens_1601260517052.html?priceId=6a24f189ecc64444b2bb451200cf0a9b,https://s.alicdn.com/@sc04/kf/Hcdae6efb042c40feb23dbdb3327dd5ack.png_300x300.png,$4.50,"Module Accessories M12  Lens 1/2.8 ""for Tachograph"
https://www.alibaba.com/product-detail/Hot-Brand-Color-Sorter-Parts-Camera_1601379902783.html?priceId=6a24f189ecc64444b2bb451200cf0a9b,https://s.alicdn.com/@sc04/kf/Hba1ee2d4adbd434ebdf9bf0e40b7c9b6u.png_300x300.png,$19-25,Hot Brand Color Sorter   Boards with Good Quality
https://www.alibaba.com/product-detail/Original-Used-Gimbal-Camera-Lens-Replacement_1600107365664.html?priceId=6a24f189ecc64444b2bb451200cf0a9b,https://s.alicdn.com/@sc04/kf/H9771e9163c734199bc1042ed032be7b7O.jpg_300x300.jpg,$21-25,Original Used Gimbal  Lens Replacement for DJI Mavic Pro Drone Repair
https://www.alibaba.com/product-detail/Manufacturer-DVP-Interface-3MP-Miniature-CMOS_62454218494.html?priceId=6a24f189ecc64444b2bb451200cf0a9b,https://s.alicdn.com/@sc04/kf/Hd1f9e2513d4e445c9b2e37f7b394c632m.jpg_300x300.jpg,$16,Manufacturer DVP Interface 3MP Miniature CMOS  Module Sensor AR0330
https://www.alibaba.com/product-detail/T40-T20P-T50-T25-Agricultural-Drone_1601664906827.html?priceId=6a24f189ecc64444b2bb451200cf0a9b,https://s.alicdn.com/@sc04/kf/H5de7644ab6964b7e841efc3d81de14089.jpg_300x300.jpg,$3-4,T40 T20P T50 T25 Agricultural Drone  Gimbal Cover for T40 T50 T25 Agricultural Drone  Drone Accessories
https://www.alibaba.com/product-detail/Camera-Set-for-Samsung-Galaxy-S23_1601578716446.html?priceId=6a24f189ecc64444b2bb451200cf0a9b,https://s.alicdn.com/@sc04/kf/Ha6fbf46127dd4828affda6bd1f9b97aci.jpg_300x300.jpg,$39-41,Set for Samsung Galaxy S23 Ultra SM-S918/SM-S918B (Telephoto + Periscope + Wide + Main ) Phone   Repair
https://www.alibaba.com/product-detail/Wholesale-Custom-Aluminum-Die-Casting-Electrical_1600306811841.html?priceId=6a24f189ecc64444b2bb451200cf0a9b,https://s.alicdn.com/@sc04/kf/Hcacdc83d3b0d4709a4dbfd4452d02dd63.png_300x300.png,$6-7,Wholesale Custom Aluminum Die Casting Electrical  Oem Aluminum Die Casting Cctv  Housing
https://www.alibaba.com/product-detail/esp8266-ESP32-Camera-Module-Development-Board_62102508117.html?priceId=6a24f189ecc64444b2bb451200cf0a9b,https://s.alicdn.com/@sc04/kf/HLB186A4mDZmx1VjSZFGq6yx2XXaA.jpg_300x300.jpg,$8-11,esp8266 ESP32  Module Development Board OV2640  Type-C Mini  Board circuit  support BOM
https://www.alibaba.com/product-detail/OEM-DSLR-Camera-Accessory-Kit-Custom_60611537089.html?priceId=6a24f189ecc64444b2bb451200cf0a9b,https://s.alicdn.com/@sc04/kf/H916af6e0bc724253ac2794bd8086c4e3v.jpg_300x300.jpg,$0.80-1.50,OEM DSLR  Accessory Kit Custom  Lens Cover
https://www.alibaba.com/product-detail/Wide-Angle-Front-Rear-Clear-Focus_1601574245144.html?priceId=6a24f189ecc64444b2bb451200cf0a9b,https://s.alicdn.com/@sc04/kf/Hc9473162f32a4e59ad488c5418b2b1f2B.jpg_300x300.jpg,$19.99-59.99,Wide Angle Front & Rear Clear Focus  for iPhone 12 12 Pro Max 12 Mini 12 Pro Max Replacement  for Test Back Clear
https://www.alibaba.com/product-detail/High-Precision-5Axis-Aluminum-Alloy-Gimbal_1601438343754.html?priceId=6a24f189ecc64444b2bb451200cf0a9b,https://s.alicdn.com/@sc04/kf/H3502f0bc977c45a4bddeb2bce871d1ffg.jpg_300x300.jpg,$0.20-0.90,High Precision 5Axis Aluminum Alloy Gimbal  for UAV  Mount CNC Machining Service Custom Wire EDM Broaching
https://www.alibaba.com/product-detail/2805-Hot-Sale-Mini-Camera-GoPros_1601684127104.html?priceId=6a24f189ecc64444b2bb451200cf0a9b,https://s.alicdn.com/@sc04/kf/Hee78ca6c715d4e329b4331a02b1c7b7aL.jpg_300x300.jpg,$7-16,2805 Hot Sale Mini  GoPros  Platform Hand Holder Brushless Gimbal Motor
https://www.alibaba.com/product-detail/Aluminum-Turning-5-Axis-CNC-Copper_1601690467985.html?priceId=6a24f189ecc64444b2bb451200cf0a9b,https://s.alicdn.com/@sc04/kf/H7e672a2a291549868103b78d2da78e7ee.jpg_300x300.jpg,$0.10-0.50,Aluminum Turning 5 Axis CNC Copper Fittings with Copper and Bronze  for Precision Optical  Accessories
https://www.alibaba.com/product-detail/Black-1-4-Inch-Two-Nut_60155835967.html?priceId=6a24f189ecc64444b2bb451200cf0a9b,https://s.alicdn.com/@sc04/kf/Hf47e3ab5322545dea91059f6a0d02b66I.jpg_300x300.jpg,$0.50-1.57,Black 1/4 Inch Two Nut Mount Adapter for Tripod Screw   Screws
https://www.alibaba.com/product-detail/CADDX-ECLIPSE-009CA-960x768-Thermal-Imaging_1601636982236.html?priceId=6a24f189ecc64444b2bb451200cf0a9b,https://s.alicdn.com/@sc04/kf/Haca2025cd1fb4e698adbb6618c2ba56e5.jpg_300x300.jpg,$489-519,CADDX ECLIPSE 009CA 960x768 Thermal Imaging  for RC FPV Racing Freestyle Drones DIY
https://www.alibaba.com/product-detail/OEM-Factory-12MP-Smart-Terminal-Device_1601160681942.html?priceId=7b2f1bedded64217939fbfca62e8e323,https://s.alicdn.com/@sc04/kf/Ha00361d0f9044f158605cdb05e88e0b8x.jpg_300x300.jpg,$27,OEM Factory 12MP Smart Terminal Device  Module Embedded Built-in USB  Module
https://www.alibaba.com/product-detail/Macro-Extension-Tube-Set-Compatible-for_1601661384526.html?priceId=7b2f1bedded64217939fbfca62e8e323,https://s.alicdn.com/@sc04/kf/H9668e03975d44d238d6d104cad750523h.jpg_300x300.jpg,$3.99,Macro Extension Tube Set Compatible for Nikon DSLR  Macro Photography Adapter Metal Material and Manual Operate Tools
https://www.alibaba.com/product-detail/Custom-CNC-Machining-Stainless-Steel-Aluminum_1601698074416.html?priceId=7b2f1bedded64217939fbfca62e8e323,https://s.alicdn.com/@sc04/kf/H859621b5025c4ea0aaf2c7355aa42dc2Y.jpg_300x300.jpg,$0.50-5,Custom CNC Machining Stainless Steel & Aluminum  with for Machining for  Accessories and Machinery Applications
https://www.alibaba.com/product-detail/Customized-High-Precision-5-Axis-CNC_1601635651113.html?priceId=7b2f1bedded64217939fbfca62e8e323,https://s.alicdn.com/@sc04/kf/H7f066bedaee74e6e8dc0078e75cb09cez.png_300x300.png,$7.95-9.75,Customized High-Precision 5-Axis CNC Machining Aluminum  CNC Turning Rolling Services  Lens Set Machining
https://www.alibaba.com/product-detail/ANJVISION-5-Megapixel-MC-L12D-Dual_1601564913390.html?priceId=7b2f1bedded64217939fbfca62e8e323,https://s.alicdn.com/@sc04/kf/Ha506ec9cec7c434ab2c6fca7b4f94d7cD.jpg_300x300.jpg,$13-16,ANJVISION 5 Megapixel MC-L12D Dual Light  Module Unisex Plastic RC Boat & Airplane
https://www.alibaba.com/product-detail/BG-70D-Vertical-Battery-Grip-Holder_1600767406499.html?priceId=7b2f1bedded64217939fbfca62e8e323,https://s.alicdn.com/@sc04/kf/H469459aff2f3489591d3c579a9ae1516b.jpg_300x300.jpg,$35.15,BG-70D Vertical Battery Grip Holder for Canon EOS 70D 80D 90D DSLR  Replacement As BG-E14
https://www.alibaba.com/product-detail/Multifunction-Camera-Base-Plate-with-15mm_1601041673756.html?priceId=7b2f1bedded64217939fbfca62e8e323,https://s.alicdn.com/@sc04/kf/H1b69c0d9dfbe40a89dd56afa6c5c41cc3.png_300x300.png,$16-18,Multifunction  Base Plate with 15mm Rod Rail Clamp for Dslr  Shoulder Rig Support Accessories
https://www.alibaba.com/product-detail/Camera-Module-for-Oculus-Quest2-VR_1601046048354.html?priceId=7b2f1bedded64217939fbfca62e8e323,https://s.alicdn.com/@sc04/kf/Ha536c2bc624341f0adcd9b9374cc81f37.png_300x300.png,$5.72,Module for Oculus Quest2 VR Headset  Sensor Assembly Replacement
https://www.alibaba.com/product-detail/BEXIN-Wholesale-Aluminium-Alloy-Camera-Tripod_1600449295149.html?priceId=7b2f1bedded64217939fbfca62e8e323,https://s.alicdn.com/@sc04/kf/H54542fc37dcd40b5ab0551177bfa6578d.jpg_300x300.jpg,$0.33,BEXIN Wholesale Aluminium Alloy  Tripod  Length 20mm  Screws 1/4 3/8 Inch Dslr  Mounting Conversion Screw
https://www.alibaba.com/product-detail/1500TVL-JINJIEAN-B19-Mini-1-3_1601054462741.html?priceId=7b2f1bedded64217939fbfca62e8e323,https://s.alicdn.com/@sc04/kf/H3965598a6f7645f8bb73e277acdd3a17N.jpg_300x300.jpg,$5.99-8.99,1500TVL JINJIEAN B19 Mini 1/3 CMOS FPV  With PAL/NTSC System 3DNR With OSD Internal Adjustable Power 5V-30V for Drone
https://www.alibaba.com/product-detail/Drone-Components-for-Foxeer-10x-Zoom_1601091119218.html?priceId=7b2f1bedded64217939fbfca62e8e323,https://s.alicdn.com/@sc04/kf/H02b4ef098d2c47a791ba86a03e8facb3r.jpg_300x300.jpg,$72.98-83.58,"Drone Components for Foxeer 10x Zoom 700TVL CMOS  PWM Control CVBS PAL NTSC 1/3"" CCD+Effio DSP FPV UAV  RC Quadcopter"
https://www.alibaba.com/product-detail/Hot-Selling-8-Accessories-Set-for_1600164567404.html?priceId=7b2f1bedded64217939fbfca62e8e323,https://s.alicdn.com/@sc04/kf/Hf6aa3c951aa9469192c99f8f778c9b1dB.jpg_300x300.jpg,$8.60-8.80,Hot Selling 8 Accessories Set for Go Pro Hero Accessories s  Accessories Combo Kit
https://www.alibaba.com/product-detail/UV-for-Tamron-28-75-L1_1601121184004.html?priceId=7b2f1bedded64217939fbfca62e8e323,https://s.alicdn.com/@sc04/kf/Hb53584bb056241c897108e86f2e25c4cP.jpg_300x300.jpg,$17.50-18.50,UV for Tamron 28-75 L1 Original  Repair
https://www.alibaba.com/product-detail/New-O4-Air-Unit-Pro-Metal_10000036617186.html?priceId=7b2f1bedded64217939fbfca62e8e323,https://s.alicdn.com/@sc04/kf/S8ab29ebbd7cf4f32880cbeb1f6710f80C.jpg_300x300.jpg,$255,New O4 Air Unit Pro Metal Drone Remote Control   Compatible All Models Private Mold  Modules Product Category
https://www.alibaba.com/product-detail/TELESIN-PC-ABS-Protective-Accessories-for_1601193550086.html?priceId=7b2f1bedded64217939fbfca62e8e323,https://s.alicdn.com/@sc04/kf/H5af519cc4ffd49b6a3f2de7a4cb45ffcP.jpg_300x300.jpg,$2.50-2.90,TELESIN PC ABS Protective Accessories for Insta360 X4 Action  Standard Protective Frame
https://www.alibaba.com/product-detail/Customized-High-Quality-CNC-Lathe-Command_1601516131056.html?priceId=7b2f1bedded64217939fbfca62e8e323,https://s.alicdn.com/@sc04/kf/Hecbdd65e33e24915bca7960879fc5051c.jpg_300x300.jpg,$0.14-0.28,Customized High-Quality CNC Lathe Command Dial DSLR Mirrorless Digital   For Sony Accessories
https://www.alibaba.com/product-detail/Factory-Direct-7-11inch-Friction-Articulated_1601208095571.html?priceId=7b2f1bedded64217939fbfca62e8e323,https://s.alicdn.com/@sc04/kf/H8f1ca8b87bf84109862e3859f995224ac.png_300x300.png,$6-8.80,Factory Direct 7/11inch Friction Articulated Arm 1/4 Hot Shoe Connector Photo Studio Accessories for  LCD Monitor
https://www.alibaba.com/product-detail/High-Quality-Industrial-Camera-Accessories-Lens_1601208502340.html?priceId=7b2f1bedded64217939fbfca62e8e323,https://s.alicdn.com/@sc04/kf/H37e0f17b7a4e4705bcf089e64ea35e17H.jpg_300x300.jpg,$29,High Quality Industrial  Accessories Lens 2/3 Inch 35mm 5MP C Mount Machine Vision Lens
https://www.alibaba.com/product-detail/Precision-Custom-5-6-Axis-OEM_1601215921606.html?priceId=7b2f1bedded64217939fbfca62e8e323,https://s.alicdn.com/@sc04/kf/Haa653ef389094770ad533f3910c60b1aA.jpg_300x300.jpg,$3,Precision Custom 5 6 Axis OEM Machining Service Center Custom Aluminum Underwater   CNC Machining Customized
https://www.alibaba.com/product-detail/Factory-Custom-Optical-Zoom-Camera-Module_1601514514614.html?priceId=7b2f1bedded64217939fbfca62e8e323,https://s.alicdn.com/@sc04/kf/Hef6d78073b4b4e87841c588383433d74y.jpg_300x300.jpg,$260-320,Factory Custom Optical Zoom  Module IMX585 CMOS Sensor H264 H.265 HD 60fps Mipi  Module
https://www.alibaba.com/product-detail/Dropshipping-Wholesale-Phone-Spare-Parts-for_1601227507868.html?priceId=7b2f1bedded64217939fbfca62e8e323,https://s.alicdn.com/@sc04/kf/He3df77ce9cdf4ae181aded59c4e9a5499.jpg_300x300.jpg,$16.84,Dropshipping Wholesale Phone Spare  for Samsung Galaxy S21 Ultra Back Facing
https://www.alibaba.com/product-detail/Action-Camera-Car-Mount-Suction-Cup_1601232552609.html?priceId=7b2f1bedded64217939fbfca62e8e323,https://s.alicdn.com/@sc04/kf/Hbaa214b2d9404c6795e363a4d05fd24bQ.jpg_300x300.jpg,$105,Action  Car Mount Suction Cup Base Stable Bracket Sports Cameras Accessories Kit for Car Video Shooting for Insta360 X3 X4
https://www.alibaba.com/product-detail/premium-quality-Shutter-Gear-Assembly-Camera_10000035587213.html?priceId=7b2f1bedded64217939fbfca62e8e323,https://s.alicdn.com/@sc04/kf/Ae0b65066af574b5ab59f548607071776f.jpeg_300x300.jpeg,$0.11,premium quality Shutter Gear Assembly  Repair  at best price in uttar pradesh
https://www.alibaba.com/product-detail/OKS-38006-Factory-Sale-High-Definition_1601245005041.html?priceId=7b2f1bedded64217939fbfca62e8e323,https://s.alicdn.com/@sc04/kf/H45c4355c91744f699bf65b22c56a09fc1.jpg_300x300.jpg,$2.80-3,OKS-38006 Factory Sale High Definition Waterproof  Lens 1/2.8 Sony Sensor 110 Degrees Focal Length F2.0 Aperture 2.8mm
https://www.alibaba.com/product-detail/Hot-Sell-High-Precision-Cnc-Machining_1601248138357.html?priceId=7b2f1bedded64217939fbfca62e8e323,https://s.alicdn.com/@sc04/kf/H93a8d3a18e2e4b3ca67043d01b953146w.jpeg_300x300.jpeg,$4-4.70,Hot Sell High Precision Cnc Machining Service Cnc Spare  for  Spare  With High Quality
https://www.alibaba.com/product-detail/Aluminum-Alloy-Die-casting-black-Anodizing_1601250344231.html?priceId=7b2f1bedded64217939fbfca62e8e323,https://s.alicdn.com/@sc04/kf/Hb07becbc64b4400a9fa69cdae42b6ee3Y.jpg_300x300.jpg,$1.35,"Aluminum Alloy Die-casting+black Anodizing, Car  Series Housing"
https://www.alibaba.com/product-detail/Back-Rear-Camera-Flex-Cable-for_1601250654765.html?priceId=7b2f1bedded64217939fbfca62e8e323,https://s.alicdn.com/@sc04/kf/Hef5ae161204543ef882dbc24484d9efaU.jpg_300x300.jpg,$7.20,Back Rear  Flex Cable for iPad Air 2020 Air 4 A2324 A2072 Main Big Facing  Module Repair
https://www.alibaba.com/product-detail/For-Huawei-Honor-X8-Rear-Back_1601266119261.html?priceId=7b2f1bedded64217939fbfca62e8e323,https://s.alicdn.com/@sc04/kf/Hbfae7af3c97d412386cb9d1b08bd111e8.jpg_300x300.jpg,$0.10-1,For Huawei Honor X8 Rear Back  Glass Lens Replacement  Cover with Adhesive Sticker TFY-LX1 TFY-LX2 TFY-LX3
https://www.alibaba.com/product-detail/Camera-Module-1-6-M5-Lens_1601266774063.html?priceId=7b2f1bedded64217939fbfca62e8e323,https://s.alicdn.com/@sc04/kf/Hdb67735c6b284cf4abb15175e299f05dJ.jpg_300x300.jpg,$5.40,Module 1/6 M5 Lens 1.69mm Focal Length 75 Degree Lens Medical Endoscopy Lens
https://www.alibaba.com/product-detail/Brand-New-Wholesale-FPV-Module-FPV_10000035012270.html?priceId=7b2f1bedded64217939fbfca62e8e323,https://s.alicdn.com/@sc04/kf/A0b8a7ec744c7491294b32016f45393a4R.jpg_300x300.jpg,$210-230,Brand New Wholesale FPV Module FPV  Module for T40 T20P Agras Drones Accessories Drone  Spare
https://www.alibaba.com/product-detail/Custom-Titanium-Iron-Cnc-Camera-Parts_1601275131950.html?priceId=7b2f1bedded64217939fbfca62e8e323,https://s.alicdn.com/@sc04/kf/H8bd9697ef88246a18379c3ea74b4319a5.jpg_300x300.jpg,$12-15,Custom Titanium Iron Cnc   Small Metal Cnc Milling Service for Machining Photographic Equipment Accessories
https://www.alibaba.com/product-detail/for-Asus-Laptop-Built-in-Parts_1601275547009.html?priceId=7b2f1bedded64217939fbfca62e8e323,https://s.alicdn.com/@sc04/kf/Hca0769fdd3bc41298d2c713250df289ek.jpg_300x300.jpg,$11-12.50,for Asus Laptop Built-in  HD Webcam IR Dual  Dual Interface  Module In Stock 04081-00420600
https://www.alibaba.com/product-detail/For-TECNO-POVA-NEO-3-LH6_1601504248281.html?priceId=7b2f1bedded64217939fbfca62e8e323,https://s.alicdn.com/@sc04/kf/H0297337146024bc8ab1b48c5b6c157072.jpeg_300x300.jpeg,$0.16-0.24,For TECNO POVA NEO 3 LH6 OEM Back  Lens Glass Replacement for Mobile Phones Rear  Repair Spare  Accessories
https://www.alibaba.com/product-detail/ov7670-FIFO-image-sensor-Camera-module_1601496750112.html?priceId=7b2f1bedded64217939fbfca62e8e323,https://s.alicdn.com/@sc04/kf/H222929fe355a4b15afd6ac601c96d7258.jpg_300x300.jpg,$4.41-5.31,ov7670 FIFO image sensor  module STM32 driving microcontroller Electronic learning integration module ov7670
https://www.alibaba.com/product-detail/Customized-Aluminum-Plastic-CNC-Machined-Turning_1601282104065.html?priceId=7b2f1bedded64217939fbfca62e8e323,https://s.alicdn.com/@sc04/kf/Hec0482c69bcb46c58d607c3b8750623dx.jpg_300x300.jpg,$0.50-5,Customized Aluminum Plastic CNC Machined Turning  Telescope Photography Sleeve  Case
https://www.alibaba.com/product-detail/Repair-Spare-Parts-LMDJSP024-Camera-Line_1601282619868.html?priceId=7b2f1bedded64217939fbfca62e8e323,https://s.alicdn.com/@sc04/kf/Hf2eb24ee523d4598a63f8443ea91b39dl.jpg_300x300.jpg,$52.50-62.50,Repair Spare  LMDJSP024  Line Transmission Wire Coaxial Gimbal Data Cable for DJI Matrice 30T
https://www.alibaba.com/product-detail/CNC-Turning-Machining-Stainless-Steel-Camera_1601285775889.html?priceId=7b2f1bedded64217939fbfca62e8e323,https://s.alicdn.com/@sc04/kf/H3060f4770ac6482caad130aa028897b1b.jpg_300x300.jpg,$1,CNC Turning & Machining Stainless Steel  Bracket Aluminum Double Ball Head Base Mount  Micro Drilling Type
https://www.alibaba.com/product-detail/Grade-5-Titanium-Camera-Equipment-Ball_1601301706172.html?priceId=7b2f1bedded64217939fbfca62e8e323,https://s.alicdn.com/@sc04/kf/H851e94975296413ab66b603f1d6017a49.jpg_300x300.jpg,$0.03,Grade 5 Titanium  Equipment Ball  Screw CNC Machining
https://www.alibaba.com/product-detail/Custom-Logo-Camera-Body-Cover-Lens_1601307852819.html?priceId=7b2f1bedded64217939fbfca62e8e323,https://s.alicdn.com/@sc04/kf/H0e29a127e73e4fadb0ccd9f5587ce29dr.jpeg_300x300.jpeg,$0.44,Custom Logo  Body Cover + Lens Rear Cover Cap Kit for Canon EOS Mount EF 5D II III 7D 70D 700D 500D 550D 600D 1000D
https://www.alibaba.com/product-detail/Custom-FPV-Camera-Mount-Bracket-for_1601690548435.html?priceId=7b2f1bedded64217939fbfca62e8e323,https://s.alicdn.com/@sc04/kf/H47fcb7a62d5242a5be4286561a275166Y.jpg_300x300.jpg,$2.50-3,"Custom FPV  Mount Bracket for Racing Drone, 0.01mm Tolerance Action Cam Holder Stabilizer Crash-Resistant Gimbal Bracket"
https://www.alibaba.com/product-detail/Original-Phantom-4-Pro-Adv-Pro_1601365071968.html?priceId=7b2f1bedded64217939fbfca62e8e323,https://s.alicdn.com/@sc04/kf/He40596729044462c9969a4b3857e8a943.jpg_300x300.jpg,$640,Original Phantom 4 Pro Adv Pro 2.0 Drone Gimbal  Replacement Gimbal with Bottom Shell Fan JHDDJI P4P Spare Repair
https://www.alibaba.com/product-detail/Radford-Custom-Aluminum-Alloy-Housings-Cnc_1601289463937.html?priceId=7b2f1bedded64217939fbfca62e8e323,https://s.alicdn.com/@sc04/kf/H145fd5266c0e409d8073b0d6d3455d59O.jpg_300x300.jpg,$0.68-2.30,Radford Custom Aluminum Alloy Housings Cnc Industry   Cnc Machining Service
https://www.alibaba.com/product-detail/Gimbal-Complete-Camera-Lens-Chip-for_1601493863960.html?priceId=7b2f1bedded64217939fbfca62e8e323,https://s.alicdn.com/@sc04/kf/H688ecca6ada1489e97286ff870abcf73G.jpg_300x300.jpg,$70-73,Gimbal Complete  Lens Chip for Air 3 PTZ  Assembly Replacement for Air 3 Repair
https://www.alibaba.com/product-detail/5mp-12mp-Y12N15A-0JG-Samsung-Sony_1601378218085.html?priceId=7b2f1bedded64217939fbfca62e8e323,https://s.alicdn.com/@sc04/kf/Hdab24faccb9343b4b355b9dae4a367748.jpg_300x300.jpg,$29.80-35,5mp 12mp Y12N15A-0JG Samsung Sony sensor  module PDAF cmos dual  module
https://www.alibaba.com/product-detail/Custom-Titanium-Brass-Copper-Aluminium-1_1601378831654.html?priceId=7b2f1bedded64217939fbfca62e8e323,https://s.alicdn.com/@sc04/kf/H79457cbda1a4412695dde5d2c4b2a3c6Z.jpg_300x300.jpg,$0.11,Custom Titanium Brass Copper Aluminium 1/4 Screw Mount Adapter Screw for
https://www.alibaba.com/product-detail/Best-Seller-Front-Small-Facing-Camera_1601388141009.html?priceId=7b2f1bedded64217939fbfca62e8e323,https://s.alicdn.com/@sc04/kf/Hf0b23ea3b3f045fa8319180db4358516v.jpg_300x300.jpg,$1.70-1.90,Best Seller Front Small Facing  for iPhone 13mini Factory Wholesale Phone  with 1 Year Warranty
https://www.alibaba.com/product-detail/3-8-16-Screw-Swivel-M4_1601389508980.html?priceId=7b2f1bedded64217939fbfca62e8e323,https://s.alicdn.com/@sc04/kf/H436f74cfe4c04844bbdecc175912b0ccr.jpg_300x300.jpg,$0.35-0.49,"3/8 - 16 Screw Swivel M4 1 Ball M10 Mount Holder 360 Tripod Sparepart Spy  for 3/8"" Thumb Conversion Screws Double Head"
